Item Name,Sale Quantity,Quantity Ordered,Sub Total,Total,Profit
BOTA P/PUNTA DE EJE EXTERNA TOYOTA HILUX 2.5/ 2.7/ 3.0 VIGO 2005  .,3,3.00,"5,419.47","CRC 1,963.50","$3,455.97"
ROT SUSP NIS VERSA 11/15 NOTE 12/20 KICKS 18 SB-N332,2,2.00,"10,194.69","CRC 6,745.00","$3,449.69"
ROTULA DIRECCION LH NISSAN TIIDA 2006-2018,2,2.00,"19,292.03","CRC 15,844.02","$3,448.01"
BUJE / ARRASTRE TIJ HD CIVIC 88-00 CRV TRAS CORBATIN GDE,2,2.00,"15,132.74","CRC 11,687.08","$3,445.66"
BUS.TIJ. DEL / MOD: CHERY-TIGGO 2 /20-24 4X2 /M.14X34X53,2,2.00,"6,194.69","CRC 2,750.00","$3,444.69"
PERMATEX GRASA DIELECTRICA 0.33oz TUNE UP 81,10,10.00,"18,193.82","CRC 14,750.00","$3,443.82"
ROTULA DIRECCION EXTERNA RH SUZUKI SWIFT 05-- SES011R,3,3.00,"18,141.59","CRC 14,700.00","$3,441.59"
EMP. TAPA VALV. I10 EPSILON 1.1 SOHC11- (Nbr) G4HG,3,3.00,"12,920.36","CRC 9,480.00","$3,440.36"
SOP.COM. DEL LH-RH / MOD: CHEV-TRAX /13-20 4X2,1,1.00,"12,389.38","CRC 8,950.00","$3,439.38"
EMP. TAPA VALV. MIT. MONTERO 2.8DIESEL (4M40),3,3.00,"15,132.73","CRC 11,700.00","$3,432.73"
"P EJE MB MIRAGE SUMMIT COLT LANCER 1,3 89-",1,1.00,"15,384.96","CRC 11,953.53","$3,431.43"
SOP COMP DEL NISSAN VERSA MARCH 12-20,2,2.00,"12,743.36","CRC 9,312.00","$3,431.36"
"""ROT. SUSP. SUP. RH/LH. HON. ACCORD. 86/89, CIVIC. 91/99, ODYSSEY. 99/03, SB-6191 = 51270-SR3-013 ,023 ,35.4MM""",2,2.00,"12,743.36","CRC 9,313.20","$3,430.16"
VLV PCV KP-120 COROLA YARIS INZ RAV4 IAZ - 122,3,3.00,"13,628.32","CRC 10,200.00","$3,428.32"
CHV HAVOLINE MO 10W40 CUARTO,5,5.00,"23,008.85","CRC 19,583.35","$3,425.50"
SOPORTE MOTOR DELANTERO HONDA CIVIC 2.0 2002-2005 // HONDA CR-V 2.4 2002-2006 // HONDA ELEMENT 2.4 2003-2011 // ACURA RSX 2.0 2002-2006,1,1.00,"13,185.84","CRC 9,760.75","$3,425.09"
ROTULA ESTAB TY YARIS 06-12 DEL SL-T020,2,2.00,"10,619.47","CRC 7,196.00","$3,423.47"
FILTRO AIRE MIT MONTERO SPORT L200 15- 2.4 TOY HIGHLANDER 09-13 3.5 13-16,2,2.00,"9,380.53","CRC 5,958.44","$3,422.09"
KASHIMA 8330 MD1210 PC PASTILLA DE FRENO DELANTERA CERAMICA TOYOTA COROLLA 09-14,1,1.00,"17,504.42","CRC 14,084.50","$3,419.92"
B AGUA CHEVROLET AVEO 1.6 SZ. FORENZA 2.0,1,1.00,"13,185.84","CRC 9,766.14","$3,419.70"
P.F. PONTIAC 06-10 /SAAB 05--/ SATURN 07-10 CHEVRO,1,1.00,"12,831.86","CRC 9,418.25","$3,413.61"
TIJERETA INFERIOR LH. HON. CRV. 07/11,1,1.00,"26,017.70","CRC 22,604.40","$3,413.30"
ROTULA ESTAB DEL RH MAZDA,1,1.00,"12,920.35","CRC 9,507.40","$3,412.95"
ROTULA ESTABILIZADORA DEL LH MAZDA,1,1.00,"12,920.35","CRC 9,507.40","$3,412.95"
TIJERETA INFERIOR DELANTERA RH. HON. CRV. 07/11,1,1.00,"26,017.70","CRC 22,604.80","$3,412.90"
FAJA DIS. GATES T212 SUZUKI SIDEKICK 16VAL 103D,1,1.00,"17,260.18","CRC 13,848.00","$3,412.18"
"ROT. SUSP. INF. RH/LH, ISZ. TROOPER, 4X4, KB, 87/97, 4X4, D-MAX. 02/06, RODEO. 4X2,4X4, 91/04, JAC 00/ CHEV. COLORADO. 12/16, 4X4, CBIS-13,SB-5302",2,2.00,"17,260.18","CRC 13,850.00","$3,410.18"
Hule-Est-Tras-Hyundai-Tucson-05-10-Kia-Sportage-04-10 M-13X48X49,2,2.00,"5,309.73","CRC 1,900.00","$3,409.73"
ROTULA ESTABILIZADORA TRASERA RH CR-V RD1/2 98-  SL-6225R,3,3.00,"13,695.58","CRC 10,286.34","$3,409.24"
TERMOSTATO VG33E - WV64BN-82A,1,1.00,"13,008.85","CRC 9,600.00","$3,408.85"
BUJIA PRECA. TY. HIACE/HILUX 2L/3L/DYNA 5L (PT-155) 11v Q=1 95mm,4,4.00,"16,608.85","CRC 13,200.00","$3,408.85"
PASTILLA F BMW 328i 328xi 07-08 323i 125i 128i 08-13,1,1.00,"18,955.75","CRC 15,548.65","$3,407.10"
SET CABLES DE BUJIA TOYOTA CAMRY 200I/ 220I/ RAV4 2.0 WITH BIG DUST CAP AND LONGER,1,1.00,"5,575.22","CRC 2,172.50","$3,402.72"
"ROT. CREMA. HYU. STAREX, H1. 07/18, CRKH-34, 18X14X263.5 = 57724-4H100",1,1.00,"10,619.47","CRC 7,218.00","$3,401.47"
"ROT. SUSP. RH/LH. HON. CRV. 01/05 , CIVIC. 02/05, ELEMENT. 03/ , SB-6272",2,2.00,"13,097.34","CRC 9,696.00","$3,401.34"
EMP. CABEZOTE HD. CR-V 2.0 B20B 96-(METAL),1,1.00,"13,097.35","CRC 9,700.00","$3,397.35"
GALLETA AMORTIGUADOR DELANTRO SUZUKI CIAZ,1,1.00,"15,486.73","CRC 12,092.95","$3,393.78"
CONECTA ALT. TOYOTA (OVALADO IN437) (3L),2,2.00,"13,592.92","CRC 10,200.00","$3,392.92"
JGO.DESCARB TOYOTA 3E 87,1,1.00,"12,831.86","CRC 9,440.55","$3,391.31"
Tornillo-Barra-Est-Del-Toyota-Yaris-Echo-99 -05-Yaris-14-23-M-98MM,4,4.00,"10,591.15","CRC 7,200.00","$3,391.15"
EMP. MULTPL.ADM.13119-57800 G16V 96- - 16VLV METALICO,1,1.00,"12,389.38","CRC 9,000.00","$3,389.38"
EMP.MULTPL.ESC.MD072804 EXCEL 1.5 - JC-023-LA,2,2.00,"12,389.38","CRC 9,000.00","$3,389.38"
TORNILLO DE CABEZOTE TOYOTA 4E/5E (5+5),1,1.00,"12,920.35","CRC 9,535.00","$3,385.35"
PALL HC9020FDP4Z B3=200,1,1.00,"11,504.42","CRC 8,120.00","$3,384.42"
Rotula Cremallera Externa Hyundai Accent Blue 2010-2017,1,1.00,"5,044.25","CRC 1,661.00","$3,383.25"
"ESCOBILLA 21"" PYLON",8,8.00,"20,929.22","CRC 17,554.32","$3,374.90"
ROTULA DIRECCION INTERNA HILUX 4WD  88-DYNA SE-2852,2,2.00,"12,566.37","CRC 9,193.50","$3,372.87"
"FAJA BOSCH T139 / DIST 25mm ancho/149 dientes, Galloper 3.0/Montero 3.0",1,1.00,"12,920.35","CRC 9,550.71","$3,369.64"
SOP.MOT. LH TIPO: CORTO / MOD: NISS-SENTRA-B13-B14 GA16 /91-99 MT 4X2,1,1.00,"10,619.47","CRC 7,250.00","$3,369.47"
ZAPATA DE FRENO HILUX/4RUNNER01-04 TUNDRA03-06TACOMA,1,1.00,"15,132.74","CRC 11,765.41","$3,367.33"
EMP CBZTE MD145826 6G72 97-00 SOCH 24VAL AS,2,2.00,"12,566.37","CRC 9,200.00","$3,366.37"
MANGUERA  FRENO  TRASERA  MITSUB. MONTERO 01-06 55.9 NF383135,2,2.00,"12,566.37","CRC 9,200.00","$3,366.37"
BUSHING DIFERENCIAL DELANTERO / MOD: SUZUKI-GRAND VITARA /99-05 4X2-4X4 /M.12X50X60 (SIDEKICK),2,2.00,"7,734.00","CRC 4,372.00","$3,362.00"
EMP. TAPA VALV. NI SENTRA B13/B14 1.6DOHC GA16DE (USA),3,3.00,"15,330.95","CRC 11,970.00","$3,360.95"
BUSH. YUGO DEL. NISSAN TIIDA- VERSA B16 06-16,2,2.00,"11,150.44","CRC 7,789.96","$3,360.48"
Sop Mot LH Nissan Versa March 12-18 Kicks 16-23 HR16,1,1.00,"8,849.56","CRC 5,495.00","$3,354.56"
MANGUERA RADIADOR SUPERIOR TOY TERCEL 90-94 EL40/42 3E 1 1/16   1 1/8 USA. OEM 1657111210,2,2.00,"12,743.36","CRC 9,393.48","$3,349.88"
PASTILLA DE IGNICION UNIVERSAL 6 PINES CARGA PESADA,1,1.00,"4,778.76","CRC 1,430.00","$3,348.76"
PASTILLA F HY TERRACAN SZ XL7 CHEVR EQUINOX CAPTIVA 07,1,1.00,"12,831.86","CRC 9,483.36","$3,348.50"
FILTRO AIRE CABINA MIT L200 MONTERO SOPRT 2006-,2,2.00,"6,902.66","CRC 3,555.04","$3,347.62"
ANILLOS SWM31063 010 G15B EXCEL 1.5 - 1.5/1.5/4,1,1.00,"12,743.36","CRC 9,400.00","$3,343.36"
ANILLOS SWM31063 020 G15B EXCEL 1.5 - 1.5/1.5/4,1,1.00,"12,743.36","CRC 9,400.00","$3,343.36"
FAJA D/H COROLLA 85/92 A/C TERCEL 89/94 5PK0915/VITARA M16,2,2.00,"8,141.60","CRC 4,800.00","$3,341.60"
MONROE AMORTIGUADOR GM D ISU/NIS 4X4 VARIOS O/P MO-34968,2,2.00,"19,646.02","CRC 16,305.30","$3,340.72"
JP2465H SOP. MOTOR DER-IZQ SUZUKI GRAND VITARA 09-16,1,1.00,"44,955.75","CRC 41,617.23","$3,338.52"
PUNTA DE EJE KIA PICANTO 09-,1,1.00,"14,336.28","CRC 10,998.61","$3,337.67"
GUIA PIÑON 13503-54030 2L 3L 5L 89- - 54TM030B01,1,1.00,"12,831.86","CRC 9,500.00","$3,331.86"
SH-1431A BRG.LEVAS STD 2L/3L 88- -11802-54020,1,1.00,"12,831.86","CRC 9,500.00","$3,331.86"
SOP COMP DEL HYUNDAI TUCSON SPORTAGE,1,1.00,"12,831.86","CRC 9,500.00","$3,331.86"
SOP-MOT-RH-CHEV-SPARK-98-05-800CC-F8C,1,1.00,"12,831.86","CRC 9,500.00","$3,331.86"
Sop Mot RH Nissan 720 D21 Pathfinder 4x4,1,1.00,"12,831.86","CRC 9,500.00","$3,331.86"
Sop-Mot-RH-Hyundai-I10-07-13,1,1.00,"12,831.86","CRC 9,500.00","$3,331.86"
FAJA A/C TERCEL 87 ALT HILUX 4RUNNER 95/99 5PK0890,2,2.00,"10,573.75","CRC 7,242.62","$3,331.13"
"TERMINAL EXT ""L"" TOYOTA SEQUOIA 2008-2014/TOYOTA TUNDRA 2007-2014",1,1.00,"12,743.36","CRC 9,416.73","$3,326.63"
"TERMINAL EXT ""R"" TOYOTA SEQUOIA 2008-2014/TOYOTA TUNDRA 2007-2014",1,1.00,"12,743.36","CRC 9,416.73","$3,326.63"
GAZA METALICA P/BOTA 4.6X350MM,82,82.00,"6,946.91","CRC 3,623.50","$3,323.41"
ROL BOCINA TRASERO SUZUKI SIDEKICK TRACKER 88-98,1,1.00,"12,566.37","CRC 9,250.00","$3,316.37"
SOPORTE DERECHO TOYOTA RAV4 2WD L4 1.8 2.0 96-00,2,2.00,"43,716.82","CRC 40,402.80","$3,314.02"
"MANGUERA RADIADOR SUPERIOR TOY ECHO YARIS 1.3 1.5 16V 99-05 1/2NZ 1"" 3/16 OEM 1657221020",3,3.00,"12,212.40","CRC 8,899.14","$3,313.26"
PASTILLA FRENO KIA SORENTO 02-- V/USA,1,1.00,"12,566.37","CRC 9,253.62","$3,312.75"
EMP.MULTPL.ESC.14036-15M25 E16(B12) - HA372,1,1.00,"7,610.62","CRC 4,300.00","$3,310.62"
FAJA DISTRIB. SANTA FE 123DIENTES,1,1.00,"7,610.62","CRC 4,300.00","$3,310.62"
"FAJA ALT. UNIVERSAL, 4PK0810, 31.88",2,2.00,"8,169.92","CRC 4,860.00","$3,309.92"
FAJA ALT. MAZ 626 HON CIVIC D/H 4PK1015,2,2.00,"9,646.03","CRC 6,338.30","$3,307.73"
RET. CIG. TRAS. HD. D15B/D16A/B20A/F18B/B16A/D17A/F22/TY. 22R (80x100x10/11.5)(NJ312) NBR BI,2,2.00,"10,796.46","CRC 7,490.00","$3,306.46"
ROT. DIR. EXT. LH. TOY. DYNA. 84/03. COASTER. 84/90.,1,1.00,"12,566.37","CRC 9,261.00","$3,305.37"
EMPAQUE DE FILTRO COROLLA 2015 1.8 2ZR,1,1.00,"8,304.41","CRC 5,000.00","$3,304.41"
RETENEDOR  CIGUEÑAL TRASERO SUZUKI JIMNY/SWIFTG13A/CARRY/SAMURAY/APV(68x86x8)NJ378,3,3.00,"16,203.54","CRC 12,899.97","$3,303.57"
SOPORTE MOTOR DELANTRO SUZUKI 3570 AERIO/BALENO,1,1.00,"14,601.77","CRC 11,298.72","$3,303.05"
RETENEDOR TAPA VALVULAS (BUJIAS)NISSAN B13/B14GA14/GA16(27x49x7.5)Q=4NJ207,2,2.00,"14,102.65","CRC 10,800.00","$3,302.65"
FLOSSER BOMBILLO H16 12V 19W,1,1.00,"12,654.87","CRC 9,353.05","$3,301.82"
SOP.MOT.FRONT.DER. HYUNDAI TUCSON L,1,1.00,"44,336.28","CRC 41,036.83","$3,299.45"
BOMBA DE AGUA 4D55 / 56,1,1.00,"18,318.58","CRC 15,020.50","$3,298.08"
BOMBA AUX FRENO NISSAN SENTRA B12 SUNNY STANZA-89 TRAS R/L 5/8,2,2.00,"16,446.02","CRC 13,150.46","$3,295.56"
COMPENSADOR TOYOTA ALTIS 06-07 COROLLA 00-07 LH CORAXI -08,1,1.00,"30,973.45","CRC 27,678.97","$3,294.48"
B A CLUTCH DH TERIOS 97- 13/16,1,1.00,"12,654.87","CRC 9,362.37","$3,292.50"
BUS.COM. TRAS INF / MOD: HONDA- CIVIC /96-00 4X2 /M.10X37X40,2,2.00,"9,281.42","CRC 5,990.00","$3,291.42"
SOP-MOT-TRAS-TOYOTA-RAV4-01-05-1AZ,1,1.00,"12,212.39","CRC 8,923.00","$3,289.39"
EMP. CABEZOTE TOYOTA COR 1.6 4AF/5AFAE92/95 88-92 (grafito)(11115-16081),2,2.00,"12,389.38","CRC 9,100.00","$3,289.38"
PASTILLA SANTA FE 18- i30 VELOSTER,1,1.00,"18,230.09","CRC 14,943.71","$3,286.38"
PASTILLA F HD CRV 13- V LATINA,1,1.00,"16,771.68","CRC 13,489.44","$3,282.24"
FAJA ALT SANTA FE 00/05 TERCEL 95/98 PATH 4PK0945,3,3.00,"12,212.40","CRC 8,932.32","$3,280.08"
FILTRO AIRE ISUZU D-MAX 12- 2.5 4JK-1E5,2,2.00,"6,796.46","CRC 3,516.38","$3,280.08"
Filtro Servicio Liviano Aire Primario Panel AF7893T,1,1.00,"7,079.65","CRC 3,800.00","$3,279.65"
CINTA O CUERDA DE PITO / AIRBAG TOYOTA LAND CRUISER PRADO LEXUS LX300 / FJ CRUISER,1,1.00,"5,044.25","CRC 1,765.50","$3,278.75"
ANILLOS SWT 10143 010 3E SWT 10105 - 1.5/1.5/3.0 -7,1,1.00,"12,477.88","CRC 9,200.00","$3,277.88"
FILTRO ACEITE FUSO ISUZU MITSUBISHI NISSAN,3,3.00,"12,862.83","CRC 9,585.00","$3,277.83"
LUZ LATERAL (ESQUINERO) RH TOYOTA COROLLA AE110 .,2,2.00,"5,309.74","CRC 2,035.00","$3,274.74"
BOMBA AUXILAR CLUTCH TY YARIS 06-16 13/16,1,1.00,"9,933.00","CRC 6,660.00","$3,273.00"
SL-7950L-M ROT ESTAB DEL LH L200 05- TERRACA,1,1.00,"16,771.68","CRC 13,500.00","$3,271.68"
SL-7950R-M ROT ESTAB DEL RH L200 05- TERRACA,1,1.00,"16,771.68","CRC 13,500.00","$3,271.68"
ZAP. F.M. SZ GRAND VITARA 09-13 NY,1,1.00,"16,771.68","CRC 13,500.00","$3,271.68"
HULE DE BARRA ESTABILIZADORA DELANTERA NISSAN,2,2.00,"12,389.38","CRC 9,118.56","$3,270.82"
ZAPATA FRENO SUZUKI IGNIS SWIFT 17-,1,1.00,"8,849.56","CRC 5,580.00","$3,269.56"
MS-1227A BRG.BNCDA STD HR16DE - 12215-BC20A,1,1.00,"11,968.14","CRC 8,700.00","$3,268.14"
"ROT. DIR. EXT. RH/LH TOY. HILUX VIGO. 15/20, 4X2, 4X4, FORTUNER. 07 4X4, SE-A121, SE-3891, 45046-09310",2,2.00,"12,212.39","CRC 8,950.00","$3,262.39"
SOP COMP MB OUTLANDER 07-ASX 10- LANCER 07-PG CITROEN JEEP,2,2.00,"18,000.00","CRC 14,739.00","$3,261.00"
SOP.TRANS. NISSAN JUKE RS L4-1.6 2014-2016 STD 6 VEL FWD,1,1.00,"12,566.37","CRC 9,306.00","$3,260.37"
FILTRO DE COMBUSTIBLE CONDOR 1RZ/ 2RZ 2002 .HEI 109MM OD 64MM M12X1.25,2,2.00,"4,601.76","CRC 1,342.00","$3,259.76"
B AGUA HY TUCSON IX35 i40 GAS G4NC 2.0 10- ELANTRA 11-,1,1.00,"12,389.38","CRC 9,137.85","$3,251.53"
PASTILLA FRENO TRASERO MINI COOPER 07-12,1,1.00,"18,079.65","CRC 14,829.76","$3,249.89"
ROTULA SUSPENSION SUPERIOR GRACE H100 PORTER 94- SB-7761,2,2.00,"16,283.19","CRC 13,033.38","$3,249.81"
VALVOLINE MAXLIFE 20W50 3 OF 5 QT LATAM,1,1.00,"12,477.88","CRC 9,228.45","$3,249.43"
UNION UNIVERSAL 28/ 59/ CLIP INTERNO,2,2.00,"5,349.55","CRC 2,101.00","$3,248.55"
B A CLUTCH SZ SWIFT 05- 1.3 1.5 13/16,1,1.00,"12,477.88","CRC 9,230.78","$3,247.10"
JP-1508 BUSH PUNTA TIJ TOYOTA RAV4 96-00 SOLO BUSH TVA,3,3.00,"11,946.90","CRC 8,700.00","$3,246.90"
"(G) FIL TRANS AUT TY COROLLA 13-1.6 15 1.8 ALTIS 13- 1.6 1.8",2,2.00,"14,690.26","CRC 11,444.62","$3,245.64"
"FAJA ALT. UNIVERSAL, 5PK1420, 55.90""",1,1.00,"6,977.88","CRC 3,735.00","$3,242.88"
REGULADOR INT MITSUBISHI NISSAN QUEST 12 VOLTIOS 3.3 YR5973,1,1.00,"16,364.60","CRC 13,122.25","$3,242.35"
Disco de Clutch 2002 Honda CR-V LX 4X4 2400 cc,1,1.00,"7,079.65","CRC 3,839.00","$3,240.65"
"""ROT. ESTAB. DEL. RH/LH. HYU. TUCSON, KIA SPORTAGE. 04/10, 4X2, CLKH-23,CLKH-29, SLK-8040,TIPO Z. 273X12=1F000""",2,2.00,"12,389.38","CRC 9,150.40","$3,238.98"
"ROT. ESTAB. DEL. RH/LH. HYU. TUCSON, KIA SPORTAGE. 04/10, 4X2, CLKH-23,CLKH-29, SLK-8040,TIPO Z. 273X12=1F000",2,2.00,"12,389.38","CRC 9,150.40","$3,238.98"
NGK DPR8EIX-9 BUJIA DE ENCENDIDO DE IRIDIUM CON RESISTENCIA,5,5.00,"33,185.85","CRC 29,950.00","$3,235.85"
EMP. TP. VLV.13270-V5000 VG30/VG33 {2] - JN-570,2,2.00,"12,035.40","CRC 8,800.00","$3,235.40"
EMP.TP.VLV.13270-V5000 VG30/VG33 {2] - JN-570,2,2.00,"12,035.40","CRC 8,800.00","$3,235.40"
"ROT. DIR. EXT. LH. NIS. SENTRA. 07/12, B16, SE-N291L= D8640-ET00A",2,2.00,"12,035.40","CRC 8,800.00","$3,235.40"
ROT. SUSP. IS.KB.RODEO 2Y4WD 81/94 KORANDO SB5143,2,2.00,"12,035.40","CRC 8,800.00","$3,235.40"
JUEGO EMPAQUE MOTOR TOYOTA HILUX/HIACE 2.4 DOHC 2RZ 93 - (GRAPHITE),1,1.00,"25,132.74","CRC 21,900.00","$3,232.74"
ROTULA DIRECCION LH TROOPER RODEO SE-5281L,3,3.00,"14,513.28","CRC 11,284.68","$3,228.60"
BOSCH FAJA MICRO-V 7PK1930 (76P),2,2.00,"15,861.95","CRC 12,635.42","$3,226.53"
BOMBILLO P/DASH 12V 1.2 W,54,54.00,"4,115.05",CRC 891.00,"$3,224.05"
SOP-MOT-DEL-CHEV-SPARK-98-05-800CC-F8C,1,1.00,"9,469.03","CRC 6,255.00","$3,214.03"
DISCO F SZ DEL VITARA TODOS 99-04 CHEVROLET 00-04 2P,2,2.00,"29,088.50","CRC 25,874.52","$3,213.98"
Hule-Est-Del-Nissan-Sentra-B14,4,4.00,"6,513.28","CRC 3,300.00","$3,213.28"
AF2884 Filtro Servicio Liviano Aire Primario Panel,1,1.00,"12,212.39","CRC 9,000.00","$3,212.39"
BOMBA AUXILIAR CLUTCH 31470-52120 1NZFE 1.5 06-08,1,1.00,"12,212.39","CRC 9,000.00","$3,212.39"
CHV DELO ELC PRMX 50/50 (6/1 GAL),1,1.00,"12,212.39","CRC 9,000.00","$3,212.39"
PASTILLA F CHERY A3,1,1.00,"12,212.39","CRC 9,000.00","$3,212.39"
RET. CIG. TRAS. HY. TUC/ELAN 2.0-1.8/H100/GAL/TER 2.5 D4BH(80x96x9)(NJ251),2,2.00,"12,212.39","CRC 9,000.00","$3,212.39"
ROT. SUSP. INF. ISUZU KB 2WD 81/87 CB156,2,2.00,"12,212.39","CRC 9,000.00","$3,212.39"
SB-H572 ROTULA SUSPENSION LH-RH INFERIOR / HONDA-CIVIC 4X2 12-18 /M.12,2,2.00,"12,212.39","CRC 9,000.00","$3,212.39"
RETENEDOR  CIGUEÑAL TRASERO TUC/ELAN2.0-1.8/H100/GAL/TER2.5D4BH(80x96x9)(NJ251),2,2.00,"12,212.38","CRC 9,000.00","$3,212.38"
SOP-MOT-HYUN-ELANTRA-01-05-TRASERO,1,1.00,"10,610.62","CRC 7,400.16","$3,210.46"
"FAJA ALT.UNIVERSAL 5PK1800, 71""",1,1.00,"8,849.56","CRC 5,644.31","$3,205.25"
Filtro Servicio Liviano Aire Primario Panel AF2005T,1,1.00,"5,454.87","CRC 2,250.00","$3,204.87"
PASTILLA FRENO SEMI METALICA HYUNDAI H100 05-07 STAREX 4X2,1,1.00,"12,300.88","CRC 9,096.85","$3,204.03"
MS-1623 BRG.BNCDA.020 4JB1/G2/H1 85- -8-94168,1,1.00,"16,201.77","CRC 13,000.00","$3,201.77"
MANGUERA  FRENO DEL LH HONDA CIVIC 88-95 HO 65.4 SH62407 NF380058,1,1.00,"12,300.88","CRC 9,100.00","$3,200.88"
TERMOSTATO W52SR-82 G16A G13A J18 17600-608,2,2.00,"15,957.76","CRC 12,760.00","$3,197.76"
"BRAZO TENSOR INF. RH. TOY. RAV. 00/05, CHERY TIGGO. 3,4,5, 14/22 (JP-2273)",1,1.00,"12,610.62","CRC 9,415.00","$3,195.62"
ROLL BOC TRAS MB LANCER MIRAGE 90-99,1,1.00,"14,460.18","CRC 11,264.80","$3,195.38"
SOPORTE TRANSMISION NISSAN SENTRA 1.6/2.0 1991-1999,1,1.00,"12,123.89","CRC 8,929.49","$3,194.40"
FILTRO AIRE G.VITARA 09-13 2.4 V6 3.2   FMA-2139,2,2.00,"6,991.15","CRC 3,801.70","$3,189.45"
Sop-Mot-Tras-Toyota-Yaris-06-23-ATM-1NZFE,1,1.00,"12,035.40","CRC 8,850.00","$3,185.40"
MANGUERA INF RAD (CODO) SUZ SAMURAI 84 SJ413,2,2.00,"8,141.60","CRC 4,956.84","$3,184.76"
FIL AIRE MITSUBICHI 300 GAS 87-,1,1.00,"6,637.17","CRC 3,458.03","$3,179.14"
TUBO RADIADOR-BOMBA AGUA OPTRA/AVEO 1.6 DOHC/AVEO 1.5 SOHC,1,1.00,"12,123.89","CRC 8,950.00","$3,173.89"
"""ROT. ESTAB. DEL. RH/LH. CHEV. SPARK GT. 13/16, BEAT LTZ. 2018, CLKD-17. TIPO Z. 262X10""",2,2.00,"13,762.83","CRC 10,590.00","$3,172.83"
ROL DIFERENCIAL HILUX VIGO 30306 NTN 30X72XX19X16 30306JR,1,1.00,"12,212.39","CRC 9,040.00","$3,172.39"
SOP. MOT. FRONT. DER. HYUNDAI CRETA L4 1.6 2017-2018,1,1.00,"42,743.36","CRC 39,571.22","$3,172.14"
"FAJA UNICA CHEV. 88/89, 5.0, 5.7, 6PK2565 , 101""",1,1.00,"12,123.89","CRC 8,951.86","$3,172.03"
FILTRO AIRE CABINA SUZUKI SX-4 06- 1.5 06-15 1.6 06-15 2.0,3,3.00,"8,676.10","CRC 5,504.91","$3,171.19"
DISCO F NS DEL SENTRA B13 91-,2,2.00,"30,088.50","CRC 26,917.32","$3,171.18"
SOP COMP DEL CHEV AVEO 02-15 SPARK 05-15,1,1.00,"10,619.47","CRC 7,450.00","$3,169.47"
BALANCIN ADMISION C-1,2,2.00,"17,168.14","CRC 14,000.00","$3,168.14"
PUNTA DE EJE HYUNDAI TUCSON 00-KIA SPORTAGE 04- HEMITSUBISHIRA 26x25x42 interna,1,1.00,"20,088.50","CRC 16,921.51","$3,166.99"
FILTRO ACEITE GMC ISUZU,1,1.00,"11,415.93","CRC 8,250.00","$3,165.93"
FILTRO DE AIRE KIA RIO,1,1.00,"11,415.93","CRC 8,250.00","$3,165.93"
TIJERETA LH DAIHA CHARADE G10087/93,1,1.00,"15,061.95","CRC 11,900.00","$3,161.95"
MANGUERA INF. RAD. HYU. TERRACAN. 01/08,1,1.00,"6,637.17","CRC 3,475.82","$3,161.35"
"""BOMBA AGUA HY ELANTRA 1.8CC 12- /TUCSON 09- /SPORTAGE 11-""",1,1.00,"16,201.77","CRC 13,041.00","$3,160.77"
PASTILLA DELANTERA FRENO CERAMICA HY ELANTRA VELOSTER ACCENT 10- BLUE KIA RIO,2,2.00,"30,088.50","CRC 26,930.44","$3,158.06"
PTA EJE TRAS INT HONDA CR-V 97-06 23X25X35,1,1.00,"15,957.52","CRC 12,800.00","$3,157.52"
"""ROLL BOC DEL TY TERCEL EL40 EL50 91-98""",1,1.00,"12,035.40","CRC 8,878.85","$3,156.55"
FILTRO AIRE CABINA MURANO SUNNY X-TRAL CIVIC DMAX  12- 2.5 3.0 LANCER  OUTLANDER,4,4.00,"11,504.43","CRC 8,349.23","$3,155.20"
BOTA EJE 22X75X109,4,4.00,"8,265.47","CRC 5,112.52","$3,152.95"
BOMBA DE COMBUSTIBLE COROLLA 4AF/ 5AF .,1,1.00,"5,132.74","CRC 1,980.00","$3,152.74"
BATERIA RECORD GARANTIA GRUPO D R42-O-MF,1,1.00,"39,649.56","CRC 36,500.00","$3,149.56"
BOCINA DEL NISSAN MAXIMA XTRAIL 00-08 9429002,1,1.00,"11,946.90","CRC 8,800.00","$3,146.90"
CABLE CLUTCH SENTRA B14 95- - 30770 1M200,1,1.00,"11,946.90","CRC 8,800.00","$3,146.90"
FAJA DIST 2L 3L HILUX 88 - 129MR31-129 DNTS. 31M,1,1.00,"11,946.90","CRC 8,800.00","$3,146.90"
TENSOR P/FAJA 13505-54010 L/2L -89 - 60TB026B02,1,1.00,"11,946.90","CRC 8,800.00","$3,146.90"
RET CIG DEL HY ACC 1.5/VER1.5/1.6/BLUE/RIO1.5/CAPTIVA 2.4,3,3.00,"10,357.53","CRC 7,212.57","$3,144.96"
"POLEA TENSORA SOLA. NIS.SENTRA. 94/99, B14, 12X84X25 11925-1M202",2,2.00,"24,424.78","CRC 21,280.00","$3,144.78"
FILTRO SERVICIO LIVIANO COMBUSTIBLE DIESEL PRIMARIO ELEMENTO,2,2.00,"12,942.48","CRC 9,800.00","$3,142.48"
SE-5321L EXT.LH. ISUZU NKR 93- NPR 99- - 8-97107,1,1.00,"16,038.94","CRC 12,900.00","$3,138.94"
SE-5321R EXT.RH.ISUZU NKR 93- NPR 99- - 8-97107,1,1.00,"16,038.94","CRC 12,900.00","$3,138.94"
BUSHING DE EJE TRASERO NISSAN SENTRA 20,4,4.00,"40,353.98","CRC 37,217.92","$3,136.06"
CABLE BUJIAS CHEVROLET AVEO 1.5 SOHC 06-/LANOS 1.5 97-02 /DAEWOO 1.5,1,1.00,"12,035.40","CRC 8,900.00","$3,135.40"
PASTILLA FRENO MB MONTERO SPORT / NATIVA 97-16 TRAS,1,1.00,"12,035.40","CRC 8,900.00","$3,135.40"
ROL EMPUJE NEW PICANTO 1.2 11-15/PICANTO/ATOS 1.1 06-10/GRAND i10/i10 1.2/i20,1,1.00,"12,035.40","CRC 8,900.00","$3,135.40"
YD137 TAPA 4AFE/5EFE 93 /PASEO 91-/AE102 - 1910,1,1.00,"12,035.40","CRC 8,900.00","$3,135.40"
Bush-Tens-Tras-Suz-Ingis-Carry-00-08- Celerio-10-15-Chev-Spark-98-04-(Del- Jimny-98-22)-M-12X46X64,3,3.00,"11,415.93","CRC 8,286.00","$3,129.93"
FAJA A/C COROLLA 83/88 D/H A/C LANCER 95/03 5PK1065,2,2.00,"8,325.28","CRC 5,200.00","$3,125.28"
GALLETA PARA COMPENSADOR DEL RH MINI COOPER 02-07 1.6,2,2.00,"40,884.96","CRC 37,759.70","$3,125.26"
Rol/Tensor de Distribucion Hyundai Tucson G4GC,1,1.00,"5,132.74","CRC 2,007.50","$3,125.24"
ROT DIR EXT LH SUZ CARRY 98/16 CHANGAN,1,1.00,"9,000.00","CRC 5,875.00","$3,125.00"
"ROL BOCINA DEL. NIS. FRONTIER. 05/10, KIA SPORTAGE. 98/02",2,2.00,"14,123.89","CRC 11,000.00","$3,123.89"
PASTILLA CHERY TIGGO 4 2.0 05-16/ TIGGO 5 14-/ TIGGO 7 16-/LIFAN X60 12- TRASERA,1,1.00,"14,039.82","CRC 10,920.00","$3,119.82"
BUS.TIJ. DEL INF / MOD: NISS-D21 /85-97 4X2-4X4 /M.18X41X81,2,2.00,"10,619.47","CRC 7,500.00","$3,119.47"
MS-3883A BRG.BNCADA 010 J2/JT - OK6Z2-11-SG0,1,1.00,"10,619.47","CRC 7,500.00","$3,119.47"
"ROL BOCINA DEL. NIS. X-TRAIL.T30, 4X4, 43X79X45",1,1.00,"10,619.47","CRC 7,500.00","$3,119.47"
SOP.COM. TRAS LH / MOD: MAZD-323 /99 -03 4X2,1,1.00,"10,619.47","CRC 7,500.00","$3,119.47"
ABRO PINTURA MOTOR ALT TEMP AERO NEGRO,4,4.00,"14,318.60","CRC 11,200.00","$3,118.60"
FILTRO ACEITE DAIHATSU FORD RANGER HINO MAZDA 2500 TOYOTA 4RUNNER HILUX HIACE LAND CRUISER,2,2.00,"11,858.40","CRC 8,740.00","$3,118.40"
FAJA D/H ISZ TROOPER KB RODEO 86/95,2,2.00,"7,787.61","CRC 4,669.80","$3,117.81"
CADENA DIST. ARBOL HY. ACCENT 1.6 06-10/RIO (25 ESLABONES),1,1.00,"12,017.70","CRC 8,900.00","$3,117.70"
BEARING BANCADA 0.20 1E/2E 84-86,1,1.00,"11,858.41","CRC 8,741.25","$3,117.16"
"ROT. DIR. EXT. LH. HON. CRV. 12/19, SE-H501L, CEHO-50",1,1.00,"11,769.91","CRC 8,655.29","$3,114.62"
BUSHING TIJERETA DELANTERA INFERIOR FORD FIESTA 2014-2017,2,2.00,"11,858.41","CRC 8,744.37","$3,114.04"
NGK CABLES BUJIA ACURA INTEGRA 1.8 9162,1,1.00,"23,628.32","CRC 20,514.47","$3,113.85"
BOMBA AUXILIAR CLUTCH ISUZU DMAX 3.0 2.5 4JK 10- 4X2 13/16,1,1.00,"11,946.90","CRC 8,835.67","$3,111.23"
Bush-Punta-Tij-Del-Hyundai-Elantra-06-10 M-14X66.5X34X60,2,2.00,"7,610.62","CRC 4,500.00","$3,110.62"
FILTRO AIRE MITSUBISHI LANCER 1.5 2.0 2.3 2.4 OUTLANDER 2.4 3.0,2,2.00,"11,504.42","CRC 8,400.00","$3,104.42"
ROTULA SUSPEN SUPERIOR MONTERO 95-00 SB-7721,2,2.00,"11,504.42","CRC 8,400.00","$3,104.42"
ZAPATA FRENO NISSAN D21 4X2 86-97 PATHFRENOIENDER URVAN 92-14,1,1.00,"15,713.27","CRC 12,610.03","$3,103.24"
SENSOR TEMP. TY. COROLLA 93-99/CELICA (87°-92°)/ TERCEL 95- 5E,2,2.00,"13,083.19","CRC 9,980.00","$3,103.19"
FILTRO ACEITE ELEMENTO SOF-B-7026 BMW 525D/530D/535D 09-17 X5/X6 10-13,2,2.00,"11,398.23","CRC 8,296.70","$3,101.53"
MANGUERA SALIDA BAY PASS G. VITARA 2.0 2/4WD 5P 00-10   1/2.,3,3.00,"11,415.93","CRC 8,314.50","$3,101.43"
EMPAQUE CABEZOTE 4.3L CHEVROLET 85-99,1,1.00,"11,769.91","CRC 8,673.00","$3,096.91"
"SE-3841 ROT.DIR. LH-RH EXT / TOY-LAND CRUISER-PRADO 4X2 03-09/M.15X14X124,5",2,2.00,"10,088.50","CRC 7,000.00","$3,088.50"
SENSOR DE ARBOL DE LEVAS TOYOTA CAMRY/ AVENSIS/ IPSUM 2.4 2AZ-FE YARIS  VITZ,1,1.00,"4,884.96","CRC 1,798.50","$3,086.46"
FAJA TOY. YARIS W JETTA GOLF 6PK115,2,2.00,"11,858.40","CRC 8,773.52","$3,084.88"
FILTRO DE AIRE HYUNDAI TUCSON SPORTAGE CERATO,2,2.00,"9,203.54","CRC 6,120.00","$3,083.54"
BOMBA BPC CMLA-046,1,1.00,"15,794.69","CRC 12,711.86","$3,082.83"
SOP.MOT. DEL / MOD: HYUN-ACCENT G4EF /06-10 MT-ATM 4X2,1,1.00,"15,631.86","CRC 12,550.00","$3,081.86"
FILTRO ACEITE ELEMENTO SOF-L-2007 CHEROLET COLORADO 12- 2.5 TRAIREL BLAZER,3,3.00,"11,415.93","CRC 8,334.77","$3,081.16"
FAJA DIST. GATES T138 TOYOTA RAV4-CAMRY 2.0 3S,1,1.00,"11,769.91","CRC 8,691.20","$3,078.71"
ROL DE BOCINA TOYOTA COROLLA 03/17 40X74X42,1,1.00,"7,964.60","CRC 4,888.35","$3,076.25"
BOMBA GASOLINA DELGADA (SUMERGIBLE)ADAPTABLE GSP,1,1.00,"11,495.58","CRC 8,420.00","$3,075.58"
MANGUERA  FRENO  DELANTERA MITSUB. MIRAGE 94-00 HO 43.8 NF380203,2,2.00,"13,274.34","CRC 10,200.00","$3,074.34"
"BOMBA AGUA HYUNDAI SANTA FE 2,4 01-04",1,1.00,"17,123.89","CRC 14,050.00","$3,073.89"
GAZA MANGUERA 16-25MM [TAMAÑO 6] Q.100,48,48.00,"4,127.44","CRC 1,056.00","$3,071.44"
TACO TOY MONTERO 12MMX1.5 49.5M 14M FRESADO,28,28.00,"10,447.58","CRC 7,376.60","$3,070.98"
FAJA DIST 4D68 2.0 - 158RUCT32-158 DNTS. 32MM,1,1.00,"11,769.91","CRC 8,700.00","$3,069.91"
CB-387 BRG BIELA STD ELANTRA 1.8,1,1.00,"7,168.14","CRC 4,100.00","$3,068.14"
FILTRO ACEITE CHEVROLET HOLDEN,2,2.00,"12,442.48","CRC 9,380.00","$3,062.48"
"FILTRO COMBUSTIBLE DIESEL IX55 09- 3,0 SANTA FE 2,2 06- TUCSON 04-10 KIA KARENS 06-RIO S",4,4.00,"15,256.64","CRC 12,195.30","$3,061.34"
ROL TRASERO MIRAGE,1,1.00,"8,761.06","CRC 5,700.00","$3,061.06"
FAJA 6PK1310 K060515,2,2.00,"10,353.98","CRC 7,299.76","$3,054.22"
BEARING DE LEVAS B/13B/14B,1,1.00,"8,849.56","CRC 5,800.00","$3,049.56"
FILTRO AIRE CABINA SCA-P-514 CF10135 CAF1758 HONDA CIVIC 01/05 CRV 02/06,5,5.00,"11,504.40","CRC 8,456.25","$3,048.15"
ROT SUSP SUZ VITARA 17/SXA4 S-CROSS,1,1.00,"7,490.27","CRC 4,443.00","$3,047.27"
NJ-207RETENEDOR TAPA BUJIA GA16 89-ARBOL - 2,6,6.00,"10,796.46","CRC 7,750.00","$3,046.46"
FILTRO DE AIRE TOYOTA COROLLA 2002-  IPSUM 2AZ 2001-  NOAH 1NZ 2002- ALLEX,3,3.00,"4,778.76","CRC 1,732.50","$3,046.26"
EMP. TAPA VALV. HD. CIVIC D17A,2,2.00,"9,642.47","CRC 6,600.00","$3,042.47"
SOP PARA MOTOR NISSAN APRIO TRANSMI,1,1.00,"8,849.56","CRC 5,808.06","$3,041.50"
BOTA EJE TRIPOD 23X72.5X99,4,4.00,"8,318.58","CRC 5,277.44","$3,041.14"
BOTA EJE TRIPOD 24X86.5X124,4,4.00,"8,318.58","CRC 5,277.44","$3,041.14"
FUSIBLE PEQUEÑO TIPO CUCHILLA 6 PIEZAS,21,21.00,"3,964.59",CRC 924.00,"$3,040.59"
FILTRO DE AIRE NISSAN SENTRA/ MURANO 3.5/ X-TRAIL/ SERENA QR20/ TEANA IMPORT LIBERTY QR20D IMP 2003-SKYLINE 1984 /,2,2.00,"4,247.78","CRC 1,210.00","$3,037.78"
FAJA  AUT GEO/CIVIC CRV 2.0.SUZUKI  GA16DE-B13 91-  4PK825,6,6.00,"12,566.35","CRC 9,528.82","$3,037.53"
Filtro de Aire Nissan Sentra B13,5,5.00,"6,116.81","CRC 3,080.00","$3,036.81"
