Item Name,Sale Quantity,Quantity Ordered,Sub Total,Total,Profit
Grand Summary:,"2,036,630","41,989.75","587,891,508.01","CRC 376,116,421.95","$211,775,086.06"
AMORTIGUADOR TY Yaris 13-16 (17) Tras G (48530-0D570),222,22.00,"4,690,060.22","CRC 319,000.00","$4,371,060.22"
Cremallera de Dirección sin Rotulas Toyota Rav4 2001-2006 1AZ,38,38.00,"4,437,415.94","CRC 1,757,168.94","$2,680,247.00"
CENTRO DIFERENCIAL TOYOTA HILUX YN 4:55 RATIO/ PROP 9.41 10 HOLES MOUNTING IMPORT DIFF HILUX  4X2 2008-,31,31.00,"3,785,840.75","CRC 1,472,905.26","$2,312,935.49"
Cremallera de Dirección sin Rotulas Toyota Rav4 1997-2000 3SFE,25,25.00,"2,901,751.87","CRC 1,131,900.00","$1,769,851.87"
Cremallera de Dirección sin Rotulas Toyota Rav4 2005-2008 2AZ,38,38.00,"2,719,292.11","CRC 1,021,552.29","$1,697,739.82"
Cremallera de Dirección sin Rotulas Toyota Corolla 1994-2001 (AE111) (44250-12581),20,20.00,"2,296,566.39","CRC 887,590.00","$1,408,976.39"
Radiador Nissan Sentra 96 1.6,54,52.00,"2,054,312.25","CRC 813,909.48","$1,240,402.77"
DISTRIBUIDOR TOYOTA COROLLA 4AFE/ 5AFE ELECTRONIC,33,33.00,"2,034,371.77","CRC 816,885.56","$1,217,486.21"
"90080-19021 90919-02265 BOBINA IGNICION UF316 YARIZ,ECHO,PRIUZ,UF-316",214,214.00,"4,855,313.35","CRC 3,638,000.00","$1,217,313.35"
Cremallera de Dirección sin Rotulas HONDA CR-V 95-01,17,17.00,"2,154,513.28","CRC 960,802.94","$1,193,710.34"
Cremallera de Dirección sin Rotulas TOYOTA RAV4 12-18,29,29.00,"2,136,283.22","CRC 961,615.21","$1,174,668.01"
BUMPER TRASERO TOYOTA HILUX VIGO CHROME  FLAT TYPE 2005-,29,29.00,"1,839,486.09","CRC 731,228.56","$1,108,257.53"
Cremallera de Dirección sin Rotulas TOYOTA YARIS  06-13,27,27.00,"1,782,132.72","CRC 778,422.15","$1,003,710.57"
Bomba de Combustible Hyundai Accent 1999-2004 G4EK,63,63.00,"1,410,787.60","CRC 550,935.00","$859,852.60"
Cremallera de Dirección sin Rotulas TOYOTA COROLLA 92-97 (AE100),12,12.00,"1,485,875.92","CRC 656,827.32","$829,048.60"
Alternador 12V 90A Hyundai Accent IV 1.4 1.6 2010-2018 i20 I 1.4 1.6 2008-2015 i30 1.4 1.6 2007-2011 ix20 1.4 1.6 2010-2019 Solaris 1.4 2017- Veloster 1.6 2011-2017,24,24.00,"1,498,619.40","CRC 672,579.36","$826,040.04"
Cremallera de Dirección sin Rotulas NISSAN TIDA/VERSA,21,21.00,"1,447,867.17","CRC 639,933.00","$807,934.17"
BOBINA ORIGINAL TOYOTA RAV4 01-- 90919-02266 UF-333 90919-02243,125,125.00,"2,860,757.88","CRC 2,125,000.00","$735,757.88"
Cremallera de Dirección sin Rotulas Toyota Corolla 1997-2001 (AE111) (44250-12581),10,10.00,"1,130,761.08","CRC 443,795.00","$686,966.08"
Alternador 12V 80A Toyota Yaris 1.3 1.5 2010-2020 Yaris Vios 1.5 2006-2013  Corolla 1.5 4WD 2006-2012 Allion I 1.5 1.8 4WD 2001-2005 Premio 1.5 1.8 4WD 2001-2007,23,23.00,"1,194,097.59","CRC 529,427.34","$664,670.25"
BOBINA DE IGNICIÓN NISSAN VERSA-SENTRA-KICKS-QASHQAI (07-)   22448-1KT1A  22448-5RB0A 22448-1HC0A 22448-ED000 UF-550 UF-549 UF-719,112,112.00,"2,537,507.40","CRC 1,904,000.00","$633,507.40"
NGK LZKR6B-10E BUJÍA NÍQUEL PARA HYUNDAI Y KÍA PICANTO HEX.16MM ROSCA 12X26.5MM,246,246.00,"1,463,891.57","CRC 846,065.27","$617,826.30"
Radiador Nissan Sentra B13,26,26.00,"1,011,320.38","CRC 419,991.00","$591,329.38"
Cremallera de Dirección sin Rotulas NISSAN XTRAIL,7,6.00,"955,407.07","CRC 369,663.72","$585,743.35"
Alternador 12V 70A Toyota Yaris Echo 1.3 1.4 1.5 1999-2005,19,19.00,"1,031,973.72","CRC 464,889.15","$567,084.57"
COMPENSADOR TOYOTA ETIOS 12- DELANTERO R/L,81,81.00,"1,870,460.17","CRC 1,308,081.15","$562,379.02"
Cremallera de Dirección sin Rotulas Toyota Corolla 2010-2014 2ZR,13,13.00,"846,088.54","CRC 325,468.00","$520,620.54"
BOBINA DE IGNICIÓN SUZUKI ALTO (09-15) 1.0L / SUZUKI SX4-GRAND VITARA ERTIGA 1.6L UF-634 33400-85K20 33400-51K20  33400-51K60 33400-M68K20 3PIN UF634,93,93.00,"2,096,533.33","CRC 1,581,000.00","$515,533.33"
Cremallera de Dirección sin Rotulas Toyota Corolla 2008-2013,12,12.00,"813,274.37","CRC 300,432.00","$512,842.37"
BOCINA RUEDA LIBRE TOYOTA LAND CRUISER FZJ79 FZJ105 PRADO FRESADO 30 DIENTES,18,17.00,"771,858.38","CRC 262,735.00","$509,123.38"
Alternador 12V 80A Hyundai Accent II 1.3 1.5 1999-2006 Getz 1.3 1.4 4.6 2003-2010  Tucson 2.0 2004-2010 4WD Coupe I II 1.6 2.0 2001-2009 Elantra III 1.6 1.8 2.0 2000-2006 Matrix 1.6 1.8 2001-2010,15,15.00,"855,353.94","CRC 373,438.50","$481,915.44"
Cremallera de Dirección sin Rotulas HYUNDAI TUCSON 05-10,7,7.00,"857,345.16","CRC 383,149.27","$474,195.89"
Radiador Hyundai Accent Blue 2010-2017,23,23.00,"752,633.73","CRC 281,083.00","$471,550.73"
CHEVRON SUPREME MO 20W50 SP CUARTO,714,709.00,"2,062,383.65","CRC 1,595,837.86","$466,545.79"
UF-591 BOBINA NISSAN VERSA TIIDA,89,89.00,"1,979,238.96","CRC 1,513,000.00","$466,238.96"
Tijereta Inferior RH Hyundai Accent Blue 2016,45,45.00,"739,513.32","CRC 279,675.00","$459,838.32"
SET DE ZAPATAS DE FRENO TRASERAS TOYOTA LAND CRUISER 3F 4.5 CON HUECO CENTRAL 4.2D 4.2,28,4.00,"476,076.12","CRC 21,208.00","$454,868.12"
Tijereta Inferior RH Kia Picanto 1000 cc,40,40.00,"715,088.55","CRC 272,800.00","$442,288.55"
Cremallera de Dirección sin Rotulas Toyota Corolla Altos 01-08 3zz,8,8.00,"913,274.34","CRC 475,860.00","$437,414.34"
Tijereta Inferior LH Kia Picanto 1000 cc,36,36.00,"637,725.63","CRC 235,620.00","$402,105.63"
Cremallera de Dirección sin Rotulas HYUNDAI GRAND I10,10,10.00,"716,230.07","CRC 319,024.00","$397,206.07"
Cremallera de Dirección sin Rotulas HYUNDAI ACCENT 06-11,6,6.00,"724,778.77","CRC 328,413.66","$396,365.11"
Tijereta Inferior RH Nissan Sentra 96 1.6,36,36.00,"615,876.14","CRC 220,770.00","$395,106.14"
FOCO TRASERO (STOP) LH  TOYOTA HILUX VIGO 2011-2015 .,49,49.00,"571,395.97","CRC 190,993.00","$380,402.97"
Disco de Freno Delantero Hyundai Accent Blue 2010-2017,50,50.00,"623,794.63","CRC 244,750.00","$379,044.63"
Disco de Freno Delantero Hyundai Accent 1999-2004 G4EK,26,26.00,"490,124.79","CRC 113,971.00","$376,153.79"
Arrancador Toyota Yaris 1.3 1.5 4WD 1999-2005 Auris 1.5 2006-2012 Platz 1.3 1.5 1999-2005 Ractis 2005-2010,14,14.00,"612,831.88","CRC 236,971.56","$375,860.32"
Cremallera de Dirección sin Rotulas TOYOTA TERCEL 91-94 (3E),11,11.00,"1,169,159.30","CRC 797,230.72","$371,928.58"
Cremallera de Dirección Nissan Sentra B13,4,4.00,"572,389.10","CRC 203,198.24","$369,190.86"
Tijereta Inferior LH Hyundai Accent Blue 2016,36,36.00,"588,586.80","CRC 223,146.00","$365,440.80"
Cremallera de Dirección sin Rotulas HYUNDAI ACCENT 99-05,11,11.00,"1,103,362.88","CRC 740,912.92","$362,449.96"
TIJERETA INFERIOR RH NISSAN X-TRAIL 2004  .,10,9.00,"586,477.85","CRC 231,594.00","$354,883.85"
Cremallera de Dirección sin Rotulas HYUNDAI TUCSON 11-14,5,5.00,"635,557.53","CRC 288,140.35","$347,417.18"
Alternador 12V 90A Hyundai Accent II III 1.3 1.4 1.5 1.6 1999-2010 Tucson 2.0 AWD 2004-2010 Coupe I II 1.6 2.0 2001-2009 Elantra III 1.6 1.8 2.0 2000-2006 Getz 1.3 1.4 1.6 2002-2010,11,11.00,"620,663.33","CRC 273,854.90","$346,808.43"
FOCO TRASERO (STOP) RH TOYOTA HILUX VIGO 2011-2015 .,47,47.00,"526,723.85","CRC 183,139.00","$343,584.85"
CHEVRON SUPREME MO 10W30 SP CUARTO,542,542.00,"1,562,335.40","CRC 1,236,241.92","$326,093.48"
TIJERETA INFERIOR LH COMPLETA TOYOTA YARIS 2005 VITZ/ VIOS/,27,27.00,"534,690.25","CRC 214,423.74","$320,266.51"
Radiador Nissan Pathfinder 32AT,8,8.00,"555,858.39","CRC 238,419.60","$317,438.79"
Arrancador Toyota Hilux II V VI 2.4 4WD 1984-2002 Hiace III IV 2.4 2.8 4WD 1987-2001 4 Runner II 2.4 1989-1995 Land Cruiser 2.4 1984-1996 Crown 2.2 1980-1983 Dyna 100 2.4 1995-2001 Dyna 150 1995-1998,8,8.00,"545,752.46","CRC 234,206.56","$311,545.90"
Radiador Hyundai Accent 1999-2004 G4EK,23,23.00,"498,828.38","CRC 190,762.00","$308,066.38"
LLAVE RANA 41X21 HINO/ DYNA/ UG780/ DA .,50,50.00,"504,424.78","CRC 196,900.00","$307,524.78"
Arrancador Hyundai i10 II 1.0 1.2 2013-2019 i20 I II 1.2 2012-2020 Kia Picanto III 1.0 1.2 2017- Rio III 1.2 1.25 2011-2017 G4LA/2014- / 10D,9,9.00,"443,539.81","CRC 148,780.89","$294,758.92"
NGK BUJIA LFR5A-11 6376 / 4278,106,100.00,"669,040.57","CRC 376,028.00","$293,012.57"
TIJERETA INFERIOR RH COMPLETA TOYOTA YARIS 2005/ VITZ/VIOS,24,24.00,"477,026.54","CRC 190,021.95","$287,004.59"
BOBINA DE ENCENDIDO TOYOTA COROLLA IMP/ YARIS 1NZFE/ 2NZFE VITZ IMPORT,41,41.00,"499,557.53","CRC 213,939.00","$285,618.53"
Farol Delantero RH Hyundai Tucson 2010-2015 G4KD,9,9.00,"414,281.44","CRC 129,690.00","$284,591.44"
Bocina Trasera Hyundai Accent Blue 2016,27,27.00,"477,749.36","CRC 193,347.00","$284,402.36"
Alternador Toyota Hiace / Hilux 2L/3L 1999-2005 12v/70am.,4,4.00,"464,849.56","CRC 184,017.76","$280,831.80"
TIJERETA INFERIOR LH NISSAN X-TRAIL 2004  .,8,7.00,"457,743.35","CRC 177,149.83","$280,593.52"
Bomba de Combustible Hyundai Accent 1999-2004 G4EB,22,22.00,"471,026.49","CRC 192,390.00","$278,636.49"
FOCO TRASERO (STOP) LH TOYOTA HILUX REVO VIGO 2015- .,29,29.00,"432,464.81","CRC 157,916.00","$274,548.81"
Alternador 12V 70A Toyota Hilux II V VI 2.4 4WD Hiace IV 2.4 4WD 1995-2001 1988-2005 Dyna 100 2.4 1995-2001 Dyna 150 3.0 1998-2001 12v/70amp,5,5.00,"502,327.18","CRC 230,022.20","$272,304.98"
Radiador Honda Civic EG 1995,12,12.00,"423,442.46","CRC 151,932.00","$271,510.46"
Radiador Nissan Tida Tiida Versa 26AT,9,9.00,"450,796.74","CRC 183,457.53","$267,339.21"
Radiador Hyundai Tucson 2010-2015 G4KD,9,9.00,"429,663.70","CRC 164,983.50","$264,680.20"
FOCO TRASERO (STOP) RH TOYOTA HILUX REVO VIGO 2015- .,28,28.00,"414,296.68","CRC 151,965.00","$262,331.68"
NGK LZKAR6AP-11 BUJÍA PLATINUM PARA NISSAN MARCH Y VERSA HEX.14MM ROSCA 12X26.5MM VT 5.0,149,149.00,"1,299,366.28","CRC 1,037,436.00","$261,930.28"
Radiador Honda Civic 2001-2005 26AT,9,9.00,"430,752.24","CRC 169,527.69","$261,224.55"
KIT CLUTCH SUZUKI SWIFT DZIRE 1.2 K12,16,16.00,"1,093,081.53","CRC 831,916.96","$261,164.57"
CHEVRON SUPREME M/O 20W50  SN GALON,85,85.00,"1,154,852.20","CRC 894,828.79","$260,023.41"
Rotula Estabilizadora Delantera Hyundai Accent Blue 2010-2017,79,79.00,"339,699.10","CRC 89,507.00","$250,192.10"
LIQUI MOLY 9978 MOLYGEN ACEITE ANTIFRICCIÓN PARA MOTORES GASOLINA 10W30 5L Garantía 353-E,38,38.00,"1,169,699.25","CRC 920,751.00","$248,948.25"
SOP COMP TY YARIS 06-12 DEL (KIT COMPLETO ),40,40.00,"505,330.82","CRC 256,916.00","$248,414.82"
FOCO TRASERO (STOP) RH Toyota Hilux 2016/Current GUN125L-DGFXHF,27,27.00,"419,118.58","CRC 170,775.00","$248,343.58"
BOBINA DE IGNICIÓN HYUNDAI ELANTRA-CRETA-i20-i30 (06-12) / KIA RIO-CERATO (12-) 1.6L UF-636   /  UF-652,46,46.00,"1,029,805.30","CRC 782,000.00","$247,805.30"
Disco de Freno Delantero Kia Picanto 1000 cc,41,41.00,"407,373.44","CRC 161,683.50","$245,689.94"
SET DE ZAPATAS DE FRENO TRASERAS TOYOTA HILUX 4X4/ HIACE DIFF 1984  .,14,2.00,"256,348.66","CRC 10,945.00","$245,403.66"
Cremallera de Dirección sin Rotulas Toyota Corolla 1.4 1.6 1.8 2.0 2001-2014 Isis 2.0 2009-2014 Matrix 1.8 2002-2007 Noah Voxy 2.0 2001-2007,6,6.00,"392,920.38","CRC 150,216.00","$242,704.38"
Radiador Toyota Rav4 2001-2006 (1AZ) 26AT,7,7.00,"410,088.49","CRC 168,276.22","$241,812.27"
Cobertor de Abanico Hyundai Accent 199-2004 G4EK,21,21.00,"397,424.75","CRC 155,925.00","$241,499.75"
Radiador Honda Civic 2006-2011 26AT,8,8.00,"395,469.04","CRC 154,906.56","$240,562.48"
CLUTCH KIT NISSAN FRONTIER EXTRA CAP QR25DE(4) NISSAN URVAN 08-16 4X2,3,3.00,"1,037,230.33","CRC 798,000.00","$239,230.33"
BOCINA RUEDA LIBRE TOYOTA HILUX P690 4X4 26 SPLINES/ HIACE 4X4/ REGIUS ACE,15,15.00,"320,796.47","CRC 83,407.50","$237,388.97"
Tambor/Disco de Freno Trasero Nissan Sentra B13,37,37.00,"391,376.10","CRC 154,456.50","$236,919.60"
Alternador 12V 80A Toyota RAV4 I 2.0 4WD 1994-2000 Camry 2.2 1991-2002 Carina E VI 2.0 1992-1997 Picnic 2.0 2000-2001,6,6.00,"418,619.48","CRC 181,976.04","$236,643.44"
PASTILLA FRENO CERAMICA HYUNDAI ELANTRA VELOSTER ACCENT 10- BLUE KIA RIO DELANTERAS,54,54.00,"945,764.46","CRC 713,656.66","$232,107.80"
Alternador 12V 70A Toyota Corolla 1.6 1.8 4WD 1991-200 1 Sprinter 1.5 1.6 1991-2002 Carina E VI 1.6 1.8 1993-1997,6,6.00,"376,991.16","CRC 146,807.10","$230,184.06"
FOCO TRASERO (STOP) LH Toyota Hilux 2016/Current GUN125L-DGFXHF,27,27.00,"417,175.23","CRC 188,595.00","$228,580.23"
Tijereta Inferior RH Hyundai Accent 1999-2004 G4EK,23,23.00,"376,917.65","CRC 150,535.00","$226,382.65"
Alternador 12V 70A Honda Civic VII 1.4 1.6 1.7 2000-2005 FRV 1.7 2004-,6,6.00,"416,530.97","CRC 192,891.30","$223,639.67"
Farol Delantero LH Hyundai Tucson G4GC,15,15.00,"362,371.72","CRC 140,332.50","$222,039.22"
KIT C TY COROLLA 1.8 C/HIDRA DOHC 6V 14- (3)ETIOS,7,7.00,"1,036,141.59","CRC 814,971.92","$221,169.67"
Radiador Hyundai Accent 2012-2017 26AT,10,10.00,"393,407.07","CRC 172,556.50","$220,850.57"
Tijereta Inferior RH Toyota Yaris/Vios 09/ETIOS 2018 (NSP151L-AEXRK),19,19.00,"364,941.63","CRC 147,345.00","$217,596.63"
KIT BOCINA TRASERA CON SENSOR ABS TOYOTA YARIS/ VITZ 2006  RACTIS VIOS 2007,15,15.00,"384,159.30","CRC 168,712.50","$215,446.80"
Tijereta Inferior LH Nissan Sentra 96 1.6,19,19.00,"364,569.94","CRC 149,435.00","$215,134.94"
BOBINA DE IGNICIÓN TOYOTA COROLLA (08-12) 90919-C2003 90919-02258 UF-619 UF-596,39,39.00,"876,495.58","CRC 663,000.00","$213,495.58"
Kit Rol De Bocina Trasero Nissan Sentra B13,29,29.00,"332,159.28","CRC 121,539.00","$210,620.28"
Cremallera de Dirección sin Rotulas TOYOTA HIACE 99-05 (5L),3,3.00,"374,690.26","CRC 164,366.34","$210,323.92"
SENSOR DE OXÍGENO NISSAN VERSA (2012-2017) CAFÉ 226931KT5A 234-9106 234-9133 234-9127 22693-1KT0A  2115007700 B1 S1,11,11.00,"868,173.47","CRC 660,000.00","$208,173.47"
KIT CLUCTH SUZ SX4 1.6,9,9.00,"795,221.25","CRC 587,242.31","$207,978.94"
Arrancador Rav 4 III 2.0 2.4 2.5 3.5 4WD 2005-2018 Camry 2.0 2.4 2.5 3.5 2001-2018 Alphard Vellfire 3.5 2008-2014 Aurion 3.5 2006-2011 Harrier 3.5 4WD 2005-2008 Previa III 2.4 3.5 2005-,7,7.00,"358,699.12","CRC 151,494.77","$207,204.35"
Abanico de Radiador Nissan Sentra 96 1.6,22,22.00,"363,805.31","CRC 157,905.00","$205,900.31"
Farol Delantero RH Hyundai Tucson G4GC,14,14.00,"336,707.99","CRC 130,977.00","$205,730.99"
NGK BKR5E-11 BUJIA PROYECT.CON RESISTENCIA 14X19 MM 16 MM,289,289.00,"624,577.45","CRC 420,756.00","$203,821.45"
Radiador Toyota Yaris/Vios 14/2018 (NSP151L-AEXRK)  1NR / 2NR,7,7.00,"330,893.81","CRC 130,515.00","$200,378.81"
BOBINA DE ENCENDIDO NISSAN LIVINA/ MICRA/ QASHQAI/ TIDA / XTRAIL 1.6/ 2.0 20 TIIDA,34,34.00,"345,539.84","CRC 146,322.00","$199,217.84"
Radiador Toyota Corolla 2008-2013 16AT,9,9.00,"349,247.80","CRC 151,744.95","$197,502.85"
90919-02239 BOBINA IGNICION TOYOTA COROLLA 2009,32,32.00,"740,938.07","CRC 544,000.00","$196,938.07"
DEPOSITO DE RESERVA P/REFRIGERANTE MAZDA 3/ AXELA 2004-2011,44,44.00,"340,283.13","CRC 144,317.23","$195,965.90"
ROL BOCINA DELANTERO HYUNDAI ACCENT VERNA ELANTRA J2 1.6/ CHEVROLET AVEO 1996-1999 PICANTO 2004 / DAIHATSU TERIOS/GETZ,55,55.00,"295,545.13","CRC 102,495.77","$193,049.36"
Radiador Hyundai Accent 1999-2005 16AT,9,9.00,"338,531.29","CRC 148,780.89","$189,750.40"
CIGÜEÑAL COROLLA 4A/ 4AFE/ 5AFE/ 5AF 16V BANCADA 40MM,6,5.00,"286,548.69","CRC 99,775.50","$186,773.19"
KIT CLUTCH GEELY GC6 1.5cc GX3 190MM,12,12.00,"737,115.03","CRC 550,803.96","$186,311.07"
SET DE ZAPATAS DE FRENO TRASERAS MAZDA/ FORD 4X2/ 4X4 BT50 2005 ON 4X2 .,14,2.00,"195,313.26","CRC 9,185.00","$186,128.26"
Tijereta Inferior LH Toyota Yaris/Vios 09/ETIOS/2018 (NSP151L-AEXRK),16,16.00,"309,040.73","CRC 124,080.00","$184,960.73"
Alternador 12V 110A Hyundai Tucson 2.0 2009-2010 Sonata V VI 2.0 2.4 2005-2010 ix35 2.0 2.4 AWD 4WD 2009-2015,5,5.00,"339,070.78","CRC 154,281.10","$184,789.68"
Rotula Cremallera Interna Hyundai I-10 GL Manual G4LA,65,65.00,"275,876.10","CRC 91,162.50","$184,713.60"
CHEVRON HAVOLINE XTEND LIFE PRMX GALON,79,79.00,"939,235.60","CRC 754,789.70","$184,445.90"
PUNTA DE EJE TOYOTA COROLLA 08- C/ABS 26x32x58 externa,28,28.00,"669,097.34","CRC 484,774.64","$184,322.70"
RADIADOR TOYOTA TACOMA 2005-2015,2,1.00,"292,035.40","CRC 107,964.61","$184,070.79"
KIT CLUTCH NIS TIIDA / MARCH 1.6cc HR16,7,7.00,"743,382.79","CRC 559,803.30","$183,579.49"
BOBINA ACCENT VELOSTER 14-18,33,33.00,"743,508.87","CRC 561,000.00","$182,508.87"
Cremallera de Dirección sin Rotulas NISSAN PATHFINDER,2,2.00,"332,920.24","CRC 150,735.62","$182,184.62"
22448-6N015 UF-509 UF-350 UF-351 BOBINA NISSAN XTRAIL B15 ALMERA 22448-8H300,35,35.00,"775,066.66","CRC 595,000.00","$180,066.66"
Cremallera de Dirección Nissan Sentra B14,2,2.00,"274,380.96","CRC 95,699.86","$178,681.10"
KIT CLUTCH GEELY GC6 1.5CC GX3 190MM,11,11.00,"683,362.79","CRC 504,903.63","$178,459.16"
TAMBOR FRENO MITSUBISHI L200 SPORTERO 06- MONTERO SPORT 09-,16,16.00,"580,446.01","CRC 403,172.80","$177,273.21"
Radiador  Honda CR-V 1 GENERACION,6,6.00,"289,778.74","CRC 115,236.00","$174,542.74"
Radiador Toyota Hiace 2014-2019 (5L) 26MT,5,5.00,"310,796.46","CRC 136,992.96","$173,803.50"
Kit Rol De Bocina Trasero Hyundai Accent 1999-2004 G4EK,21,21.00,"271,805.27","CRC 98,983.50","$172,821.77"
CLUTCH KIT TOYOTA COROLLA TERCEL 4AF 7AF 1ZZ 2ZZ 3E 5E YARIS (2)TODOS,14,14.00,"861,192.92","CRC 690,060.28","$171,132.64"
Cobertor de Abanico Hyundai Accent Blue 2016,9,9.00,"272,884.95","CRC 102,217.50","$170,667.45"
BOCINA DEL NISSAN FRONTIER NP300 14-- 4X2 C/ABS 9400398,10,10.00,"587,610.62","CRC 417,191.94","$170,418.68"
Radiador Kia Picanto 1000 cc,8,8.00,"271,242.49","CRC 101,288.00","$169,954.49"
KIT BOCINA DELANTERO CON SENSOR ABS NISSAN NAVARA/ PATHFINDER 4X4 2005  ALTURA TOTAL 105MM 30x139.8x89,6,6.00,"253,239.32","CRC 83,655.00","$169,584.32"
DISCO FRENO HY DELANTERO GRAND i10 08- KIA PICANTO 04-,42,42.00,"680,722.19","CRC 512,006.52","$168,715.67"
Farol Delantero RH Kia Picanto 1000 cc,6,6.00,"244,645.69","CRC 76,065.00","$168,580.69"
KIT CLUTCH MAZDA 3.1,8,8.00,"678,920.35","CRC 510,915.36","$168,004.99"
AMORTIGUADOR DEL RH/LH MIT MIRAGE G4 12- (4060A382),20,20.00,"637,748.66","CRC 470,000.00","$167,748.66"
CHEVRON HAVOLINE GLOBAL MV ATF CUARTO,118,118.00,"735,258.24","CRC 568,116.15","$167,142.09"
Alternador 12V 90A Honda Civic VIII IX 1.6 1.8 2005-2016 FRV 1.8 2007-,4,4.00,"286,725.68","CRC 121,317.36","$165,408.32"
Farol Delantero LH Yaris/Vios NSP151L-AEXRK,5,5.00,"279,823.00","CRC 114,620.00","$165,203.00"
CLUTCH KIT NISSAN JUKE 1.6 12-17 SENTRA B17(4) QASHQAI MR20 XTRAIL,1,1.00,"628,318.58","CRC 464,734.74","$163,583.84"
KIT CLUTCH BIMASA NISSAN JUKE B17 1.6CC 2012-2017,1,1.00,"628,318.58","CRC 464,734.74","$163,583.84"
CABEZOTE COMPLETO TOYOTA  HILUX HIACE 1Y 2Y 3Y 4Y .,3,3.00,"413,141.60","CRC 249,781.00","$163,360.60"
DISCO FRENO TOYOTA DELANTERO YARIS 06-13,30,30.00,"645,012.27","CRC 481,969.80","$163,042.47"
BOBINA DE IGNICIÓN HYUNDAI ELANTRA-TUCSON (11-) / KIA SOUL-FORTE  UF-651,31,31.00,"689,504.44","CRC 527,000.00","$162,504.44"
Cremallera de Dirección sin Rotulas TOYOTA YARIS ECHO  99-05,3,3.00,"335,398.23","CRC 172,943.70","$162,454.53"
Alternador 12 90A Honda CRV III 2.0 2001-2007 FRV 2.4 2005- Stream 2.0 2001-2006,3,3.00,"286,725.66","CRC 126,406.53","$160,319.13"
TIJERETA INFERIOR RH NISSAN TIDA TIIDA/ LIVINA 2005-2012 .,18,18.00,"262,345.11","CRC 102,114.24","$160,230.87"
FIBRA DE FRENO DELANTERA HORIZON TOYOTA FORTUNER 2006- PRADO VX 2003-  HILUX VIGO 2006-  MITSUBISHI PAJERO 2016- 3.2,19,7.00,"179,056.67","CRC 19,442.50","$159,614.17"
Farol Delantero LH Kia Picanto 1000 cc,6,6.00,"235,398.52","CRC 76,065.00","$159,333.52"
Farol Delantero LH Hyundai Tucson 2010-2015 G4KD,5,5.00,"229,734.52","CRC 72,050.00","$157,684.52"
KIT CLUTH - HY G4LA  GRAND I10 1.2 4 CIL.,10,10.00,"694,668.14","CRC 538,361.22","$156,306.92"
TURBO HY SANTA FE D4EB 2.2 VGT,1,1.00,"420,353.98","CRC 265,442.48","$154,911.50"
CHEVRON GEAR OIL EP-4 75W90 CUARTO,213,212.00,"873,093.06","CRC 718,932.28","$154,160.78"
Tijereta Superior LH Nissan Sentra B13,15,15.00,"250,845.12","CRC 98,175.00","$152,670.12"
ROL BOCINA DELANTERO HYUNDAI ELANTRA 95-00 AVANTE ACCENT 00-15 VERNA BLUE,44,43.00,"492,098.23","CRC 340,632.72","$151,465.51"
TIJERETA INFERIOR RH TOYOTA  YARIS VITZ/ VIOS 1999-2002 IMPORTADO,12,12.00,"234,929.20","CRC 84,323.20","$150,606.00"
AMORTIGUADOR.Hy Accent Blue 11-18/Kia Rio 11-14/Cerato 10-/Elantra 11-14/ Forte Tras R/L MUT (554385)(554384) Gas B/B,29,29.00,"587,762.81","CRC 438,550.00","$149,212.81"
BOBINA DE IGNICIÓN HYUNDAI  ACCENT/KIA RIO (05-)UF-499,25,25.00,"574,070.81","CRC 425,000.00","$149,070.81"
AMORTIGUADOR.Hy Accent Blue 11-18/Kia Rio 12-14 Del RH MUT G (338106),17,17.00,"494,844.27","CRC 346,175.00","$148,669.27"
SENSOR OXÍGENO HYUNDAI ACCENT VERNA COREANO 5L,10,10.00,"598,587.61","CRC 450,000.00","$148,587.61"
Radiador Toyota Yaris 2006-2013 26MT,7,7.00,"250,769.92","CRC 102,579.61","$148,190.31"
SENSOR DE OXÍGENO TOYOTA YARIS-ECHO  234-4061 234-4069 13056 234-4622 89465-52060 234-4804 //234-4624 / 250-24360,21,21.00,"567,630.14","CRC 420,000.00","$147,630.14"
Tijereta Inferior LH Hyundai Accent 1999-2004 G4EK,15,15.00,"245,286.69","CRC 98,175.00","$147,111.69"
AMORTIGUADOR  NISSAN TIIDA 06-18 DEL LH,11,11.00,"386,676.41","CRC 241,070.00","$145,606.41"
AMORTIGUADOR  NISSAN TIIDA 06-18DEL RH,11,11.00,"386,676.41","CRC 241,070.00","$145,606.41"
PASTILLA FRENO CERAMICA TOYOTA YARIS 06- GREET WALL C30 SEDAN TAX,31,31.00,"460,908.32","CRC 315,469.03","$145,439.29"
ADITIVO ACEITE ALTO AL HUMO,43,9.00,"191,238.81","CRC 46,500.00","$144,738.81"
CLUTCH KIT NISSAN SENTRA B12 E16 B13/B14 GA16 (3) C/SEGURO,15,15.00,"675,777.92","CRC 531,604.80","$144,173.12"
Bobina de Encendido TOYOTA YARIS ECHO  99-05,27,27.00,"260,734.00","CRC 116,872.00","$143,862.00"
AMORTIGUADOR.MIT Mirage G4 12-21 Tras (Chasís A03A) R/L (4162A256) P/B,26,26.00,"545,670.77","CRC 403,000.00","$142,670.77"
Bobina de Encendido Hyundai Accent Blue 2010-2017,21,21.00,"194,035.41","CRC 51,397.50","$142,637.91"
Alternador 12V 100A Toyota RAV 4 II 2.0 4WD 2000-2005 Avensis 2.0 2.4 2001-2009 Previa II 2.4 4WD 2000-2006,3,3.00,"251,504.42","CRC 109,857.63","$141,646.79"
Tambor de Freno Trasero Hyundai Accent Blue 2016,20,20.00,"226,407.08","CRC 84,810.00","$141,597.08"
BOBINA DE IGNICIÓN SUZUKI  APV-JIMMY (2012-) *UNA BOBINA POR CILINDRO* 33400-62J00 33400-65G02 33410-77E01 UF-280 33400-65G00 UF-2683 PIN  2,25,25.00,"591,061.95","CRC 450,000.00","$141,061.95"
AMORTIGUADOR TOYOTA YARIS 06-12 Del LH G,21,21.00,"576,936.83","CRC 436,000.00","$140,936.83"
GALLETA DE COMPENSADOR DELANTERO RH NISSAN TIDA 2005-2012 .,29,29.00,"210,207.08","CRC 70,020.50","$140,186.58"
PASTILLA FRENO SEMI METALICA HYUNDAI ELANTRA VELOSTER ACCENT 10- BLUE SORENTO,43,43.00,"476,897.25","CRC 337,048.01","$139,849.24"
CLUTCH KIT NISSAN JUKE 1.6 12-14 SENTRA B17(3) QASHQAI MR20 T32 15-,4,4.00,"617,284.70","CRC 477,503.56","$139,781.14"
Arrancador Nissan Qashqai 1.6 2007-2013 TIIDA 1.6 2007-2012 Cube 1.6 2009- Juke 1.6 2010-2019 Micra III 2005-2010 Note 1.6 2006-2012 NV200 2010-,6,6.00,"242,901.68","CRC 104,719.50","$138,182.18"
BOCINA RUEDA LIBRE TOYOTA HILUX YN67 4X4 FRESADO 26 DIENTES,11,11.00,"210,619.47","CRC 73,643.55","$136,975.92"
Disco de Freno Delantero Toyota Yaris/Vios / ETIOS 09/2018 (NSP151L-AEXRK),12,12.00,"228,431.84","CRC 91,740.00","$136,691.84"
Tijereta Inferior Completa LH Nissan Almera II 1.5 1.8 2.0 2.2 2001-2006 Sentra V 1.8 2.0 2000-2006 Sunny IV 1.3 1.5 1.8 2.0 4x4 1997-2003,10,10.00,"224,566.24","CRC 87,924.90","$136,641.34"
Am.MIT Lancer/Mirage todos y 97-00 Tras/ Eagle Summit 93-97 (341140)(441112)(341313)(441085),19,19.00,"420,000.02","CRC 284,050.00","$135,950.02"
KIT CLUTCH MAZDA 323 1.6CC,12,12.00,"580,205.32","CRC 444,829.20","$135,376.12"
LIQUI MOLY 2324 TOP TEC 4300 ACEITE PARA MOTOR ANTIFRICCION 5W-30 5 LITROS  Garantía 353-E,19,19.00,"644,283.16","CRC 509,104.90","$135,178.26"
DISCO FRENO SUZUKI DELANTERO SWIFRENOT III 05- 1.3-1.5 CIAZ BALENO 16-,30,30.00,"557,592.96","CRC 422,537.70","$135,055.26"
Am.TY Yaris 13-16 (17) Del R/L Gas 485100D592 - 48510-0D591 / 485100D470,18,18.00,"472,884.96","CRC 338,400.00","$134,484.96"
PASTILLA FRENO CERAMICA HYUNDAI I30 1.0 1.2 GRAN i10 13-,33,33.00,"546,644.65","CRC 412,555.11","$134,089.54"
Radiador 16AT HONDA CR-V 95-01,6,6.00,"238,938.06","CRC 106,399.44","$132,538.62"
SET DISTRIBUCION NISSAN QR25 ALTIMA XTRAIL B15 2.5,5,5.00,"480,868.14","CRC 349,240.00","$131,628.14"
FILTRO ACEITE NISSAN INFINITY TOYOTA DAIHATSU,132,132.00,"286,725.12","CRC 155,361.16","$131,363.96"
Cremallera de Dirección sin Rotulas TOYOTA HIACE 05-13 (5L),2,2.00,"249,646.02","CRC 118,620.58","$131,025.44"
Motor de Abanico de Radiador Toyota Yaris/Vios 09/2018 (NSP151L-AEXRK),13,13.00,"216,353.93","CRC 85,800.00","$130,553.93"
Alternador 12V 70A Toyota Corolla 1997-2001 (AE111),4,4.00,"232,920.35","CRC 102,480.44","$130,439.91"
FOCO TRASERO (STOP) RH TOYOTA QUANTUM 2005-2013 .,21,21.00,"212,069.89","CRC 81,702.50","$130,367.39"
FOCO TRASERO (STOP) LH TOYOTA QUANTUM 2005-2013 .,21,21.00,"212,061.48","CRC 81,702.50","$130,358.98"
Radiador Hyundai Tucson 2005-2010 26AT,4,4.00,"218,053.10","CRC 87,859.92","$130,193.18"
Alternador 12V 80A Toyota Corolla 2.0 1992...,3,3.00,"236,283.18","CRC 106,399.44","$129,883.74"
GALLETA DE COMPENSADOR DELANTERO LH NISSAN TIDA 2005-2012 .,26,25.00,"192,377.86","CRC 62,562.50","$129,815.36"
DISTRIBUIDOR ELECTRONIC TOYOTA HILUX/HIACE  Y-SERIES,6,6.00,"248,548.68","CRC 118,734.00","$129,814.68"
Radiador Hyundai Grand i10 26AT,5,5.00,"213,345.13","CRC 83,645.20","$129,699.93"
FIBRA DE FRENO DELANTERA HORIZON FRONT TOYOTA CAMRY ACV40 2006- IMPORTS ALTIS 2006-2007,14,2.00,"134,277.90","CRC 5,654.00","$128,623.90"
SET DE ZAPATAS DE FRENO TRASERAS NISSAN TIDA TIIDA .,14,2.00,"134,277.90","CRC 5,654.00","$128,623.90"
AMORTIGUADOR HONDA CIVIC 06-10 TRAS R/L P/B (343460) (348023) (348078),19,19.00,"444,803.56","CRC 316,600.00","$128,203.56"
SENSOR DE OXÍGENO TOYOTA RAV4 B1 S1 L/H 250-54073 89467-42010 250-54054 89467-42030 89467-41020 234-9007 234-9023,7,7.00,"547,978.77","CRC 420,000.00","$127,978.77"
Farol Delantero RH Yaris/Vios NSP151L-AEXRK,4,4.00,"219,646.01","CRC 91,696.00","$127,950.01"
