Item Name,Sale Quantity,Quantity Ordered,Sub Total,Total,Profit
MONROE AMORTIGUADOR SUZUKI ALTO 2009- FR-RH,1,1.00,"29,292.04","CRC 21,664.98","$7,627.06"
TIJERETA INF RH NIS X-TRAI 14/16,2,2.00,"49,734.52","CRC 42,110.90","$7,623.62"
ZAPATA FRENO NISSAN SENTRA B17 13-,2,2.00,"29,380.54","CRC 21,757.82","$7,622.72"
P EJE MB TRAS EXT MONTERO 00- T/AUTM,1,1.00,"29,203.54","CRC 21,588.71","$7,614.83"
ROLL EMPUJE 47TKB3102A D16A 91- - BRG-820-228,2,2.00,"29,026.55","CRC 21,420.00","$7,606.55"
Sop-Mot-RH-Chev-Aveo-04-15,2,2.00,"27,079.64","CRC 19,475.00","$7,604.64"
BOMBA AUX FRENO HYUNDAI GRACE STAREX H100 GALLOPER RH 7/8,3,3.00,"29,203.53","CRC 21,600.00","$7,603.53"
BUS TIJ DEL INF / MOD NISS-FRONTIER-D40-NP300 /04-23 4X2-4X4,4,4.00,"38,102.65","CRC 30,500.00","$7,602.65"
Bush-Punta-Tij-Del-Daihatsu-Terios-Bego-06-16 M-14X65X32X63,4,4.00,"26,902.65","CRC 19,302.00","$7,600.65"
FAJA DIST. GATES T184 HONDA CRV 96,1,1.00,"29,115.04","CRC 21,515.00","$7,600.04"
"PUNTA EJE GEELY PANDA 1,3 08-",1,1.00,"20,000.00","CRC 12,400.29","$7,599.71"
PASTILLA FRENO SEMI METALICA TOYOTA HILUX 4WD -95 LAND C,2,2.00,"23,185.83","CRC 15,589.14","$7,596.69"
Filtro Combustible Nissan Sentra B13,12,12.00,"12,876.12","CRC 5,280.00","$7,596.12"
"BOCINA DEL. (SEMI BOCINA) HYU.TUCSON. 09/15, CRETA. 16/20, KIA SPORTAGE. 09/15, 2.0",2,2.00,"28,849.56","CRC 21,257.60","$7,591.96"
ROT.CRE. LH-RH TIPO: ORDI / MOD: CHERY-TIGGO 2 18-23 /M.14X14X354,1,1.00,"12,389.38","CRC 4,800.00","$7,589.38"
ROLLO DE PITO TOYOTA,1,1.00,"38,753.98","CRC 31,164.71","$7,589.27"
ROT DIR EXT RH HYUNDAI SANTA FE 12/19 KIA SORENTO 12/14 CEKH-49R,2,2.00,"23,185.84","CRC 15,600.00","$7,585.84"
ROTULA ESTAB MB L200 SPORTERO 06- DEL RH SL 7950R,1,1.00,"13,274.34","CRC 5,690.00","$7,584.34"
KASHIMA 1408 600 PLUS ZAPATA PARA FRENOS SEMIMETALICA SUZUKI SAMURAI,3,3.00,"29,203.54","CRC 21,624.00","$7,579.54"
BOTA P/PUNTA DE EJE EXTERNA NISSAN HARDBODY 2.4/ 2.7/ 3.0/ 3.2D 1986-/ PATROL 3.0/ S ALL 4X4 MAXIMA 2.0/ 3.0,5,5.00,"10,906.56","CRC 3,327.50","$7,579.06"
FAJA MULTIPLE GATES K040320 4PK0817 50403201,1,1.00,"11,504.44","CRC 3,927.00","$7,577.44"
AMORT DEL SUZ CIAZ 2015- LH JINBO,1,1.00,"38,753.98","CRC 31,185.00","$7,568.98"
AMORT DEL SUZ CIAZ 2015- RH JINBO,1,1.00,"38,753.98","CRC 31,185.00","$7,568.98"
B.P.C HYUNDAI ACCENT BLUE 12-14,1,1.00,"25,663.72","CRC 18,100.00","$7,563.72"
FAJA UNICA 4RUNNER  TACOMA TUNDRA 03-14 V6    7PK2120,2,2.00,"23,707.88","CRC 16,147.98","$7,559.90"
"""AMORT DEL LH SUZ CELERIO 14-20 SUZ ALTO 09-15 (K10B) C/ROT EST // Plato gde""",1,1.00,"29,115.04","CRC 21,560.00","$7,555.04"
"""AMORT DEL RH SUZ CELERIO 14-20 SUZ ALTO 09-15 (K10B) C/ROT EST // Plato gde """,1,1.00,"29,115.04","CRC 21,560.00","$7,555.04"
"POLEA CIGUEÑAL, DAMPER TOY. RAV4. 01/12, COROLLA. 09/13, 1AZ-FE, 2AZ-FE = 13470-28050",1,1.00,"38,428.32","CRC 30,879.00","$7,549.32"
B60S-34-300 TIJ.SUS. RH INF / MAZD-3 4X2 13-19   (COMPLETA CON ROTULA),1,1.00,"34,048.67","CRC 26,500.00","$7,548.67"
B60S-34-350 TIJ.SUS. LH INF / MAZD-3 4X2 13-19  (COMPLETA CON ROTULA),1,1.00,"34,048.67","CRC 26,500.00","$7,548.67"
PUNTA 43X80X40 C/ABS,2,2.00,"26,548.67","CRC 19,000.00","$7,548.67"
TIJERETA LH. HYU. ELANTRA. 00/06 54500-2D000,1,1.00,"29,026.55","CRC 21,480.00","$7,546.55"
TIJERETA RH. HYU. ELANTRA. 00/06 = 54501-2D000,1,1.00,"29,026.55","CRC 21,480.00","$7,546.55"
SOPORTE MOTOR TRASERO / MOD: HONDA-CIVIC K20 /06-11 MT 4X2,1,1.00,"23,040.71","CRC 15,495.00","$7,545.71"
MONROE AMORTIGUADOR GM-E DD HYUNDAI GETZ 02- (TB),1,1.00,"28,849.56","CRC 21,304.86","$7,544.70"
BOMBA ACEITE HY/KIA PICANTO,1,1.00,"38,509.73","CRC 30,973.45","$7,536.28"
CLUTCH KIT CHEVROLET SPARK 0.8 05- (3) DW TICO,1,1.00,"49,292.04","CRC 41,756.87","$7,535.17"
EMP CBZTE 22311-38C00 SANTAFE G4JS 2.4,1,1.00,"29,734.51","CRC 22,200.00","$7,534.51"
COROLLA RAV4 AF10202 22204-31020 MAS0363,1,1.00,"42,530.97","CRC 35,000.00","$7,530.97"
SOPORTE TRANSMISION HYUNDAI I10 1.1 2012-2014,2,2.00,"32,792.92","CRC 25,262.36","$7,530.56"
SET EMPAQUES MOTOR TOYOTA COROLLA 1.6DOHC 88-91 4AF (CARBURADO) (grafito),1,1.00,"29,026.55","CRC 21,500.00","$7,526.55"
SOP.MOT. RH TIPO: HIDRAULICO / MOD: KIA-SORENTO G4KE /14-20 ATM 4X2 (DISTRI),1,1.00,"29,026.55","CRC 21,500.00","$7,526.55"
GALLETA DEL MITSIBISHI MIRAGE L4-1.2 20,2,2.00,"25,663.72","CRC 18,141.08","$7,522.64"
JP429 BASE DE AMORTIGUADOR DEL. IZQ. DER. TOYOTA CAMRY 02-06,2,2.00,"38,265.49","CRC 30,750.48","$7,515.01"
EMPAQUE CABEZOTE DAI.CHARADE/ROCKYHD/HC,1,1.00,"11,504.42","CRC 3,990.00","$7,514.42"
Bush-Punta-Tij-Del-Toyota-Rav4-06-18 M-16.5X68X60,8,8.00,"28,315.03","CRC 20,806.00","$7,509.03"
Soporte de Transmision Hyundai Accent 1999-2004 G4EK,1,1.00,"12,300.88","CRC 4,801.50","$7,499.38"
TAMBOR F. MITSUBISHI LANCER 02 S6729 243X203X60,2,2.00,"37,939.82","CRC 30,442.48","$7,497.34"
"POLEA TENSORA COMPLETA ISZ. TROOPER. 3.2, 6VD1, 98/02,",1,1.00,"28,407.08","CRC 20,910.00","$7,497.08"
TAPON RARDIA 13 LIB PEQUEÑO,8,8.00,"20,176.99","CRC 12,680.00","$7,496.99"
PASTILLA F MZ 3-14-16,3,3.00,"24,176.98","CRC 16,688.37","$7,488.61"
ROTULA CREMALLERA EXCEL ACCENT 94-GRACE 87- EXCEL 89-  SR-7230,5,5.00,"22,123.90","CRC 14,637.00","$7,486.90"
FAJA ALT. C/AIRE SENTRA A/C ACCORD 6PK1120,5,5.00,"30,042.46","CRC 22,558.65","$7,483.81"
ROLL BOC TRAS MB LANCER CARISMA SUMMIT EAGLE,2,2.00,"37,939.82","CRC 30,459.82","$7,480.00"
ROL DODGE FORD 64/91,2,2.00,"27,079.65","CRC 19,600.00","$7,479.65"
BUSH PUNTA TIJ HYUNDAI SANTA FE 06-12 KIA SORENTO 09-13 M-14X66.5X36X60,8,8.00,"22,831.84","CRC 15,364.00","$7,467.84"
POLEA TENSORA COMPLETA MAZ. 3. 03/13,1,1.00,"28,761.06","CRC 21,295.00","$7,466.06"
Bush Tij Del Sup Toyota Hilux 4x4 84-04 Grande,6,6.00,"31,164.60","CRC 23,700.00","$7,464.60"
SOP COMP TOY RAV4 DEL JP2351 JP2173,2,2.00,"37,939.82","CRC 30,476.74","$7,463.08"
DISCO FRENO SUZUKI DELANTERO GRAN VITARA XL7 00-04,2,2.00,"48,672.57","CRC 41,210.94","$7,461.63"
COMP TY YARIS HASHBACK 19- LH DEL MZ 2 14,1,1.00,"28,584.07","CRC 21,123.86","$7,460.21"
COMP TY YARIS HASHBACK 19- RH DEL MZ 2 14,1,1.00,"28,584.07","CRC 21,123.86","$7,460.21"
ZAPATA FRENO HYUNDAI ACCENT 06- KIA RIO 06-11 CERATO,3,3.00,"32,509.74","CRC 25,050.33","$7,459.41"
"COMP CHEVROLET SPARK 1,4 16- LH",1,1.00,"25,663.72","CRC 18,204.37","$7,459.35"
"COMP CHEVROLET SPARK 1,4 16- RH",1,1.00,"25,663.72","CRC 18,204.37","$7,459.35"
GALLETA COMP HY I-20 16-DEL,4,4.00,"28,318.58","CRC 20,860.00","$7,458.58"
PUNTA EJE HY TUCSON 11- IX35 KIA SPORTAGE 09-,1,1.00,"19,557.52","CRC 12,100.00","$7,457.52"
Sop-Mot-RH-Sup-Honda-Civic-97-00-CRV- 96-01-MT-ATM-Caja,2,2.00,"26,258.40","CRC 18,802.00","$7,456.40"
VALVOLINE PB ONE SOL GEN2 15W40,4,4.00,"21,451.33","CRC 14,000.00","$7,451.33"
SOP MOTOR HONDA ACCORD,1,1.00,"28,495.58","CRC 21,044.81","$7,450.77"
SOPORTE MOTOR REFORZA JP1557 JP1176 JP1557H,2,2.00,"35,398.23","CRC 27,948.56","$7,449.67"
BOMBA DE AGUA HONDA CIVIC INTE D13B D15B D16A ZC 95-,2,2.00,"30,088.49","CRC 22,639.16","$7,449.33"
BOBINA DE ENCENDIDO TOYOTA YARIS ECHO RACTIS VIOS SOLUNA ALTIS COROLLA PRIUS 1NZFE 2NZFE IMPORTS,1,1.00,"12,212.39","CRC 4,768.50","$7,443.89"
DISCO DE CLUTCH ISUZU KB240 C24NE/ KB260/ 280/ NISSAN 1 TONNER Z24 SKYLINE 241X25.4X24,1,1.00,"12,212.39","CRC 4,768.50","$7,443.89"
TIJERETA RH TOY TERCEL 90/94 PASEO 91/95 STARLET 89/98 (CON ROT),1,1.00,"28,495.58","CRC 21,054.00","$7,441.58"
JP-1868 GALLETA COMPENSADOR DELANTERA LH HONDA CIVIC CRV 01-06 DELANTERA IZQUIERDA,4,4.00,"33,008.86","CRC 25,572.00","$7,436.86"
KIA RIO 12-15 CONECTOR REDONDO,1,1.00,"27,433.63","CRC 20,000.00","$7,433.63"
KIT ROL BOCINA DELANTERO NISSAN ALMERA 1.6 2001-2006 40x74x36,2,2.00,"11,327.43","CRC 3,894.00","$7,433.43"
ROTULA ESTAB MZ 323 99- /323F /PROTEGE 98- TRAS SL-1685,4,4.00,"25,132.74","CRC 17,708.00","$7,424.74"
PTA EJE INT TOY TACOM 95-04 27X34X47 TO-703 BT-193,1,1.00,"25,221.24","CRC 17,800.00","$7,421.24"
TIJERETA DELANTERA RH HYUNDAI ACCENT 2012-2017,1,1.00,"28,407.08","CRC 20,988.00","$7,419.08"
SOP COMP DEL TOYOTA COROLLA AE80,2,2.00,"28,318.58","CRC 20,900.00","$7,418.58"
P EJE CHEVROLET SONICAVEO AUT T300 11-,2,2.00,"28,318.58","CRC 20,900.48","$7,418.10"
CB-1825A BRG BIELA STD 4G15 90-LANCER,2,2.00,"16,017.70","CRC 8,600.00","$7,417.70"
"ROT. CREMA. CHEV. AVEO. 02/13, T200,",4,4.00,"25,486.72","CRC 18,070.00","$7,416.72"
ROL BOCINA TRASERO SUZUKI SWIFT 00-04 ALTO MURAT IGNIS C/ARANDELANTEROA ABS,3,3.00,"31,566.38","CRC 24,150.00","$7,416.38"
PUNTA DE EJE EXTERNA MITSUBISHI COLT/ RODEO LDV 4X4 28/ 25/ 56/ DELICA IMPOR 28X25X56/ PAJERO,1,1.00,"12,863.72","CRC 5,450.50","$7,413.22"
CHV GEAR OIL EP-4 75W90  (12/1 QT),8,8.00,"34,540.25","CRC 27,129.52","$7,410.73"
SENSOR DE CIGÜEÑAL MAZDA 323 ETUDE/ FAMILIA/ DEMIO ZL ENGINE MAZDA 2 MAZDA2,2,2.00,"10,874.34","CRC 3,465.00","$7,409.34"
"ROT. DIR. EXT. RH. MONTERO SPORT. 14/21, CACHETONA. 99/06, L200, SPORTERO. 05/21 = 4422A097, SE-7841R",3,3.00,"26,825.67","CRC 19,416.93","$7,408.74"
RETENEDOR  CIGUEÑAL TRASERO ACC1.5SOHC/EXC/ELA/VER1.5DOHC4G13/GETZ1.408-(72x96x9)NJ006/8,7,7.00,"32,407.10","CRC 25,000.00","$7,407.10"
DISCO SUZUKI SX4 2.0 215X150X20X22.35,1,1.00,"28,495.58","CRC 21,093.00","$7,402.58"
"ROLL EMPUJE NP-50SCRN31P-4B YARIS 05-12 ""NAC",1,1.00,"23,893.81","CRC 16,500.00","$7,393.81"
PASTILLA F MZ CX 15,2,2.00,"27,185.84","CRC 19,800.00","$7,385.84"
Bush-Punta-Toyo-Yaris-Montura-14-24 M-21X65X62,5,5.00,"22,123.89","CRC 14,750.00","$7,373.89"
BOMBA AGUA NS QG13 QG15 QG 16 QG 18 SENTRA B15 ALMERA00-06 GWN-73A,1,1.00,"17,433.63","CRC 10,060.00","$7,373.63"
"ROT. CREMA. MIT. OUTLANDER. 05/17, LANCER. 08/-- SR-B010, SR-B060, SR-2970 = 4422A076, 14X14X357 45503-29245",3,3.00,"23,716.82","CRC 16,348.92","$7,367.90"
SET DIST KIA PIACANTO G3LA ETCK2110,1,1.00,"25,663.72","CRC 18,300.00","$7,363.72"
"TIJERETA INF. LH. HYU. H100. 03/07, PORTER. 03/16= 54510-4F000",1,1.00,"28,318.58","CRC 20,956.80","$7,361.78"
"TIJERETA SUP. LH. NIS. FRONTIER. 97/04, 4X2 (SB-4821)",1,1.00,"22,633.63","CRC 15,274.60","$7,359.03"
"TIJERETA SUP. RH. NIS. FRONTIER. 97/04, 4X2 (SB-4821)",1,1.00,"22,633.63","CRC 15,274.60","$7,359.03"
CB-1208A BRG.BIELA STD GA13/14/15/16 - QG16/QG,2,2.00,"18,958.58","CRC 11,600.00","$7,358.58"
SOPORTE MOTOR RH NISSAN TIIDA 1.8 2006-2018 // NISSAN VERSA 1.8 2007-2012 // NISSAN NV200 2.0 2013-2021 // NISSAN CUBE 1.8 2009-2014,1,1.00,"28,141.59","CRC 20,783.11","$7,358.48"
TAMBOR F TY COROLLA 88-92 EE90,4,4.00,"57,345.13","CRC 49,988.52","$7,356.61"
TIJERETA HY i10 07-14 LH,3,3.00,"28,141.59","CRC 20,789.64","$7,351.95"
TIJERETA HY i10 07-14 RH,3,3.00,"28,141.59","CRC 20,789.64","$7,351.95"
FILTRO DE AIRE HYUNDAI CRETA TUCSON SPORTAGE CARENS,6,6.00,"23,433.65","CRC 16,082.00","$7,351.65"
BOMBA AUX FRENO HONDA CIVIC CRV 97-01 ACCORD 91-00 LH 13/16,3,3.00,"26,487.33","CRC 19,145.07","$7,342.26"
BOMBA AUX FRENO HONDA CIVIC CRV 97-01 ACCORD 91-00 RH 13/16,3,3.00,"26,487.33","CRC 19,145.07","$7,342.26"
ANILLOS SWT10182ZZ STD 2AZ-FE - 1.2/1.2/2.0,1,1.00,"28,141.59","CRC 20,800.00","$7,341.59"
ROTULA ESTABILIZADORA DELANTERA LH ACCENT VERNA 00-06 SLK- 8060L,8,8.00,"29,061.06","CRC 21,721.45","$7,339.61"
BOBINA MAZDA 323 GLX,1,1.00,"24,336.28","CRC 17,000.00","$7,336.28"
FAJA UNICA AIRE SANTA FE/TUCSON 6PK2005,2,2.00,"22,300.88","CRC 14,973.46","$7,327.42"
EMPAQUE CABEZOTE 1ZZFE ADBESTO,4,4.00,"29,203.54","CRC 21,883.80","$7,319.74"
BOMBA AGUA NISSAN D21 ALTIMA KA24E 4CYL GAS 240SX 12V 16V,1,1.00,"17,345.13","CRC 10,031.18","$7,313.95"
BUSHING PUNTA TIJERETA DELANTERA HONDA CIVIC 97-00- CRV-96-01,7,7.00,"27,256.65","CRC 19,950.00","$7,306.65"
ZAPATA FRENO SUZUKI SWIFRENOT 02- ALTO IGNIS - 1.0 CELERIO 0.8,2,2.00,"19,026.55","CRC 11,720.00","$7,306.55"
Soporte Motor Trasero Hyundai Tucson G4GC,1,1.00,"10,619.47","CRC 3,316.50","$7,302.97"
Soporte de Motor RH CIVIC 92-95,2,2.00,"11,150.43","CRC 3,850.00","$7,300.43"
BOMBA FRENO MB MONTERO 92-00 /L200 96-05 /NATIVA 96-05 /GALLOPER 99-04 15/16,1,1.00,"37,288.50","CRC 29,990.00","$7,298.50"
GALLETA COMPENSADOR SUZUKI VITARA 99-14 CH TRACKER 99-05 DELANTERA C/ROLL,2,2.00,"27,787.62","CRC 20,491.15","$7,296.47"
B P CLUTCH HY ACCENT 05-10 KIA RIO 5/8,1,1.00,"17,257.00","CRC 9,962.35","$7,294.65"
SOP FRONTAL HONDA ODYSSEY V6,1,1.00,"37,207.08","CRC 29,915.72","$7,291.36"
SOPORTE MOTOR DELANTERO HYUNDAI ACCENT 1.5/1.6 2000-2005,3,3.00,"29,733.62","CRC 22,442.58","$7,291.04"
RETENEDOR SALIDA  CAJA MZ.626/323/HYUNDAI ACCENT/ATOS(35x56x9/15)NJ452,9,9.00,"27,090.27","CRC 19,800.00","$7,290.27"
TUERCA RANA ALLEN CROMO 12MMX1.25 32MM 20MM,50,50.00,"24,594.70","CRC 17,306.00","$7,288.70"
AC464 AC477 22270-22060 TOYOTA COROLLA YARIZ 00-06 MATRIX 03-06 1.8L,1,1.00,"37,288.50","CRC 30,000.00","$7,288.50"
BUSH MONT CHEV SPARK-05-22-M-18X51X54 (1.0 y 1.2CC),4,4.00,"26,548.68","CRC 19,266.00","$7,282.68"
"TIJERETA SUP. RH. MIT. L200. 86/96, 4X4",1,1.00,"27,876.11","CRC 20,597.50","$7,278.61"
BUJE DIFER MB MONTERO PAJERO 02-3.8,2,2.00,"11,504.42","CRC 4,227.72","$7,276.70"
"ROT. SUSP. INF. RH/LH.TOY. HIACE. 05/17, FOTON/G9, SB-3972",2,2.00,"22,123.89","CRC 14,850.00","$7,273.89"
BRAZO CONTROL INFERIOR TRASERO MAZDA 3 2004-2013/MAZDA 5 2006-2015/FOCUS 2000-2008/FORD ESCAPE 2013-2019,4,4.00,"48,663.71","CRC 41,389.92","$7,273.79"
PASTILLA F SZ JIMNY 18-,1,1.00,"17,257.00","CRC 9,987.00","$7,270.00"
MANGUERA RAD. SUP. HY. TUC iX35 2.0/SPORTAGE 13-15 (larga),1,1.00,"17,168.00","CRC 9,900.00","$7,268.00"
ROTULA CREMALLERA YARIS HECHO 99- SR-3600,6,6.00,"26,017.71","CRC 18,750.18","$7,267.53"
FILTRO TRANSMISION AUTOMATICA CABINAENT 11-14 1.6 ELANTRA 1.6 2.0 I10 I20 I30 PICANTO 17 CERAT,4,4.00,"27,256.64","CRC 19,990.14","$7,266.50"
"TIJERETA INF. DEL. LH. MAZ. CX7. 4X2, 06/15, CBMZ-46, SB-1772=EG21-34-350",1,1.00,"36,962.83","CRC 29,700.00","$7,262.83"
BOMBA AGUA OK65A-15-100A JT/J2 BONGO - FV-45,1,1.00,"27,610.62","CRC 20,350.00","$7,260.62"
P EJE NS XTRAIL QASHQAI RENAULT KOLEOS MR20 QR25,1,1.00,"24,778.76","CRC 17,519.20","$7,259.56"
Tijereta RH Aerio lata 2005,1,1.00,"24,778.76","CRC 17,520.00","$7,258.76"
Amort.Suz Grand Vitara 06-16 Del RH G (Excepto XL-7),1,1.00,"37,207.08","CRC 29,950.00","$7,257.08"
JGO. EMP. MOTOR HY. ACCENT BLUE 1.4/i20/RIO 1.4 KAPPA16- (G4LC) (GRAFITO),1,1.00,"37,207.08","CRC 29,950.00","$7,257.08"
BATERIA AUTOCRAFT PLATINO GARANTIA GRUPO,1,1.00,"47,256.64","CRC 40,000.00","$7,256.64"
NGK BKR7EIX BUJIA C/RESISTENCIA IRIDIUM GRADO 7  14X19MM HEX.16.0MM,4,4.00,"27,256.64","CRC 20,000.00","$7,256.64"
BOBINA BYD F3,1,1.00,"24,247.79","CRC 17,000.00","$7,247.79"
REGULAR HYUNDAI ACCENT BLUE KIA 12V,1,1.00,"27,876.11","CRC 20,629.00","$7,247.11"
SOPORTE DE MOTOR LH SUZUKI STEEM  1.6CC 95-01,1,1.00,"21,238.94","CRC 13,996.00","$7,242.94"
Bush-Tij-Tras-Ext-Honda-Civic-06-11-M- 14X43X46,4,4.00,"21,238.94","CRC 14,000.00","$7,238.94"
"ROT. ESTAB. DEL. RH. NIS. X-TRAIL, X-TERRA. 03/13, SL-4910R,TIPO C. 95X12",4,4.00,"25,433.63","CRC 18,200.00","$7,233.63"
BOMBA PRINCIPAL CLUTCH HONDA CIVIC 06- 1.8 ACCORT 5/8,1,1.00,"27,699.12","CRC 20,468.45","$7,230.67"
"NGK RC-NX14 CABLES PARA BUJIAS NISSAN FRONTIER X-TERRA, PATHFINDER 1996-2004, INFINITY QX4 1997-2000",1,1.00,"36,962.83","CRC 29,733.00","$7,229.83"
"TIJERETA LH. GEELY PANDA. 08/ GX2, CARRO CHINO",2,2.00,"27,433.63","CRC 20,205.00","$7,228.63"
COMPENSADOR CHEVROLET SPARK 98- DW MATIZ DEL LH,1,1.00,"30,205.31","CRC 22,980.00","$7,225.31"
COMPENSADOR CHEVROLET SPARK 98- DW MATIZ DEL RH,1,1.00,"30,205.31","CRC 22,980.00","$7,225.31"
FIL TRANS AUT NS FRONTIER NAVARA ALMERA VERSA NS,1,1.00,"13,274.34","CRC 6,050.01","$7,224.33"
TH406 TH246 4PIN MONTERO 97-99 SPORT 3L,1,1.00,"25,221.24","CRC 18,000.00","$7,221.24"
PUNTA EJE CHEVROLET AVEO 2004-2007 1.4 SPARK 0.8,2,2.00,"32,619.47","CRC 25,399.46","$7,220.01"
Bush-Tij-Del-Inf-Toyota-Prado-09-20-Grande M-16X59X89,4,4.00,"31,019.47","CRC 23,800.00","$7,219.47"
TIJERETA LH SUZUKI SWIFT 14,1,1.00,"36,718.58","CRC 29,500.00","$7,218.58"
"POLEA TENSORA SOLA SUZ. SIDEKICK, VITARA, AERIO, SX4. H20, J18, J20. 98/-- 10X85X24 17530-77E10",2,2.00,"26,814.16","CRC 19,600.00","$7,214.16"
P.F. TY RAV4 3.5l 2011-/LEXUS/VIBE/SCION ARO 16,1,1.00,"28,821.24","CRC 21,608.75","$7,212.49"
BOMBA AUX FRENO NISSAN VERSA 09- JUKE 10- B16 SENTRA 06- 2.0 R/L 3/4,4,4.00,"27,610.61","CRC 20,398.48","$7,212.13"
ANILLOS 34132-3F STD VG33 91-75 - SWN-30120,1,1.00,"27,610.62","CRC 20,400.00","$7,210.62"
ROTULA ESTABILIZADORA LH/RH TOYOTA CAMRY 2006-2017 TIPO C,2,2.00,"13,628.32","CRC 6,425.00","$7,203.32"
"ROL JEEP, DODGE,CHEVROLET 82/2002",2,2.00,"27,787.61","CRC 20,586.00","$7,201.61"
FILTRO DE CABINA QASHQAI XTRAIL,5,5.00,"22,700.89","CRC 15,500.00","$7,200.89"
GENERICO BOBINA DE ENCENDIDO TOYOT G,1,1.00,"27,610.62","CRC 20,409.73","$7,200.89"
SR-T400 RACK END PRADO 09- 45503-60040 24x16,2,2.00,"36,800.00","CRC 29,600.00","$7,200.00"
SET BOMBILLO HID (XENON) 12V 35W 8000K 2PC 4DS FITTING P32D-5,2,2.00,"10,619.46","CRC 3,421.00","$7,198.46"
SOPORTE TRANS. NISSAN SENTRA Interno/FE Interno/FE,1,1.00,"17,168.14","CRC 9,971.50","$7,196.64"
TIJERETA RH SUZUKI. SWIFT 14,1,1.00,"36,637.17","CRC 29,450.00","$7,187.17"
BOSCH FAJA MICRO-V 4PK830 (32.1/2P),8,8.00,"28,141.58","CRC 20,956.00","$7,185.58"
Rotula Cremallera Externa LH Nissan Sentra B13,1,1.00,"8,318.58","CRC 1,133.00","$7,185.58"
ROL DE EMPUJE TOYOTA COROLLA 12VALVE ID:33/ OD:66/ W:14/ COLLAR:75 ROUND FACE,3,3.00,"12,212.39","CRC 5,032.50","$7,179.89"
ROT. CREMA. NIS. PLATINA. 02,2,2.00,"27,610.62","CRC 20,433.44","$7,177.18"
"C/BIELA HYUND D4EA 2,0LD 02-D4EB 2.2LD",1,1.00,"27,256.64","CRC 20,080.23","$7,176.41"
DEPOSITO DE RESERVA P/REFRIGERANTE NISSAN FRONTIER/ NP300 2002,2,2.00,"10,442.48","CRC 3,267.00","$7,175.48"
P EJE TY ETIOS 12- (COMPLETO) 895 mm,1,1.00,"42,769.91","CRC 35,600.00","$7,169.91"
SOPORTE MOTOR LH TUSON 2005-2010,1,1.00,"36,555.75","CRC 29,389.66","$7,166.09"
ROTULA ESTAB TY RAV4 06-TRAS SL-T225,4,4.00,"26,725.67","CRC 19,560.00","$7,165.67"
ROTULA CREMALLERAM RAV4 06-08 SR T220,5,5.00,"26,548.67","CRC 19,384.00","$7,164.67"
NGK BPR5ES BUJIA AISL PROYECTADO SUPER 14X19X20.8MM,15,15.00,"28,580.53","CRC 21,420.00","$7,160.53"
COMPENSADOR TRASERO SUZUKI JIMNY 99- CARRY 85-90 / 99- TVA-SA-343288 442047,2,2.00,"26,548.67","CRC 19,400.00","$7,148.67"
Amort. Tucson 23,2,2.00,"31,946.90","CRC 24,800.00","$7,146.90"
ANILLOS 33965-3FAC 020 6G72 DLG 91.60 - SWM-31,1,1.00,"27,345.13","CRC 20,200.00","$7,145.13"
PLATO SUZUKI ERTIGA 1.4,1,1.00,"27,522.12","CRC 20,379.00","$7,143.12"
BUS.TIJ. DEL SUP / MOD: NISS- FRONTIER-D22 /98-15 4X2-4X4 /M.14X45X55,4,4.00,"21,238.94","CRC 14,100.00","$7,138.94"
BULBO DE TRANFER MONTERO BLANCO 1L,1,1.00,"22,123.89","CRC 15,000.00","$7,123.89"
PASTILLA F MZ CX5 13-18 JEEP CHEROKEE,2,2.00,"28,576.99","CRC 21,454.00","$7,122.99"
BOMBILLO XENON 35W D2R .,2,2.00,"10,619.47","CRC 3,498.00","$7,121.47"
SOPORTE DE TORSION,1,1.00,"27,345.13","CRC 20,228.30","$7,116.83"
SR-A120 RACK END HILUX 15- FORTUNER 16- - 442,2,2.00,"36,311.50","CRC 29,200.00","$7,111.50"
SENSOR VELOCIDAD HYUNDAI,1,1.00,"23,008.85","CRC 15,897.48","$7,111.37"
BUS. TIJ. DEL SUP / MOD: TOY-LAND CRUISER-PRADO /03-09 4X2-4X4,4,4.00,"26,902.65","CRC 19,800.00","$7,102.65"
BUS.TIJ. DEL SUP / MOD: TOY-HILUX- VIGO-REVO /06-21 4X2 /M.12X40X65,4,4.00,"26,902.65","CRC 19,800.00","$7,102.65"
ESPIRAL NS SENTRA B13/ B14 DEL,2,2.00,"27,079.65","CRC 19,980.00","$7,099.65"
ESPIRAL TY COROLLA 88-92 AE/EE90/92DEL,2,2.00,"27,079.65","CRC 19,980.00","$7,099.65"
BOCINA TRASERO HONDA CIVIC 99-06 HATCHB 1.4 SEDAN 1.6 C/ABS,1,1.00,"27,256.64","CRC 20,157.01","$7,099.63"
BEARING BANCADA 0.25 HY/KIA ACCENT/RIO 11+ (MOTOR G4LC 1.4) /PICANTO/I10 11+ (MOTOR G3LA 1.0),1,1.00,"18,159.29","CRC 11,061.95","$7,097.34"
SENSOR KNOCK GOLPETEO NISSAN,1,1.00,"27,168.14","CRC 20,072.40","$7,095.74"
P EJE TY HILUX LAND CRUISER 25D,1,1.00,"27,168.14","CRC 20,073.74","$7,094.40"
Tijereta Superior RH Honda CRV I 2.0 4WD 1995-2002,1,1.00,"10,929.00","CRC 3,834.69","$7,094.31"
Bobina de Encendido TOYOTA TERCEL 95-00 (5E),1,1.00,"11,300.00","CRC 4,208.90","$7,091.10"
KIT DISTRIBUCION GATES TCK036 TOYOTA COROLLA 88-92 4AFE,1,1.00,"27,168.14","CRC 20,077.25","$7,090.89"
CB-1085A BRG.BIELA 030G3#/4G3#/4G6#/G63B - 4G,1,1.00,"10,884.96","CRC 3,800.00","$7,084.96"
SOPORTE COMPENSADOR TRAS TOYOTA TERCEL EL31 EL42 87-94,2,2.00,"23,008.85","CRC 15,924.00","$7,084.85"
SOP.MOT. LH / MOD: SUZ-SWIFT /11-18 MT-ATM 4X2,1,1.00,"27,079.65","CRC 19,995.00","$7,084.65"
DISCO DE CLUTCH MAZDA 323/ ETUDE/ 626/ B SERIES 1.8/ 2.0 225X24.2X22 .,1,1.00,"11,592.92","CRC 4,510.00","$7,082.92"
"07,09,14 HYUNDAI I30 I20 1.4 06 KIA CEE 1.4",1,1.00,"27,079.65","CRC 20,000.00","$7,079.65"
2006-2015 SANTA FE,1,1.00,"27,079.65","CRC 20,000.00","$7,079.65"
234-2058 96-99 CELICA RAV4 FLANGER,1,1.00,"27,079.65","CRC 20,000.00","$7,079.65"
234-4350 S2 CIVIC 06-15,1,1.00,"27,079.65","CRC 20,000.00","$7,079.65"
"234-4690 250-24357 HYUNDI ELANTRA, ACCENT TRACE 95-01",1,1.00,"27,079.65","CRC 20,000.00","$7,079.65"
234-4921 234-4189 TACOMA 00-04 2.7 2.4,1,1.00,"27,079.65","CRC 20,000.00","$7,079.65"
90919-05070 PC819 90919-05087 90919- 05081 PC271 TOYOTA YARIZ 00-12 PRIUS 0,1,1.00,"27,079.65","CRC 20,000.00","$7,079.65"
ALS1101 CGQHD010 ABS DELANTERO DER,1,1.00,"27,079.65","CRC 20,000.00","$7,079.65"
ALS587 ABS TUCSON,1,1.00,"27,079.65","CRC 20,000.00","$7,079.65"
ALS593 ABS TUCSON,1,1.00,"27,079.65","CRC 20,000.00","$7,079.65"
AS62 AS63 AS64 MAP HONDA CIVIC 95-00 ACORD 94-02 CR-V 97-01 REDONDO,1,1.00,"27,079.65","CRC 20,000.00","$7,079.65"
CIGUEÑAL 0902426 PARA HYUNDAI,1,1.00,"27,079.65","CRC 20,000.00","$7,079.65"
CORNETA CABLE SUB ASSY SPIRAL TOYOTA TACOMA 05-14 CO,1,1.00,"27,079.65","CRC 20,000.00","$7,079.65"
CUERDA DE VOLANTE 14CH PARA 14-17 ELANTRA FORTE RIO 93490A4110,1,1.00,"27,079.65","CRC 20,000.00","$7,079.65"
INYECTOR 96-99 ELANTRA TIBURON 1.8 2.0 250930018,1,1.00,"27,079.65","CRC 20,000.00","$7,079.65"
KIA PICANTO 11-14 CONECTOR REDONDO,1,1.00,"27,079.65","CRC 20,000.00","$7,079.65"
MAP HYUN MAP ACCENT 00-11 ELAN,1,1.00,"27,079.65","CRC 20,000.00","$7,079.65"
ROLLO DE PITO LANCER OUTLANDER 05-13,1,1.00,"27,079.65","CRC 20,000.00","$7,079.65"
SANTA FE 2010+ ELANTRA 10- REDONDO VELOSTER,1,1.00,"27,079.65","CRC 20,000.00","$7,079.65"
SENSOR DE OXIGENO HYUNDAI I10 KIA PICANTO,1,1.00,"27,079.65","CRC 20,000.00","$7,079.65"
SENSOR DE VELOCIDAD ACCENT ELANTRA 2003-2012,1,1.00,"27,079.65","CRC 20,000.00","$7,079.65"
SENSOR OXIGENO FORD RANGER/ MAZDA BT50 15716 234-4610,1,1.00,"27,079.65","CRC 20,000.00","$7,079.65"
SENSOR OXIGENO O2 LAMDA AIR FUEL RATIO HYUNDAI I30 KIA CEE 392102E300 39210-2E3,1,1.00,"27,079.65","CRC 20,000.00","$7,079.65"
SENSOR POSICION ARBOL DE LEVAS MAZDA 3/5 1999-2010,1,1.00,"27,079.65","CRC 20,000.00","$7,079.65"
SOGA DE PITO SOLARIS ACCENT 2011-2014 934901R410,1,1.00,"27,079.65","CRC 20,000.00","$7,079.65"
SOGA PITO HYUNDAI SANTA FE TUCSON 2.0,1,1.00,"27,079.65","CRC 20,000.00","$7,079.65"
SOGA PITO NISSAN QASHQAI XTRAIL,1,1.00,"27,079.65","CRC 20,000.00","$7,079.65"
TAPA TUCSON SPORTAGE SONATA 2015-20,1,1.00,"27,079.65","CRC 20,000.00","$7,079.65"
"TIJERETA LH. TOY. YARIS, ECHO. 99/05, 14.3 MM",1,1.00,"27,079.65","CRC 20,000.00","$7,079.65"
FITTING CABEZOTE 4D56,1,1.00,"23,008.85","CRC 15,929.20","$7,079.65"
BOMBA AUXILIAR CLUTCH HYUNDAI GRACE H100 STAREX  13/16,3,3.00,"29,425.15","CRC 22,351.92","$7,073.23"
BOMBILLO H4 P43T 12VOLT 100/ 90W OFF ROAD,9,9.00,"9,791.34","CRC 2,722.50","$7,068.84"
JCCD-32NS DISCO CLUTCH VG30 V6 NSD104U 250,1,1.00,"36,067.26","CRC 29,000.00","$7,067.26"
PISTONES STD ACCENT 1.6 2001-2003,1,1.00,"36,067.26","CRC 29,000.00","$7,067.26"
P EJE IZ RODEO 97- TROOPER 98- KB AMIGO DMAX,2,2.00,"35,985.84","CRC 28,920.00","$7,065.84"
"POLEA TENSORA SOLA C/TOR, AJUSTE, NIS. PATHF. 05/14, R51, NAVARA. 05/16, FRONTIER NP300. 14/- URVAN. 05/-11X84X34",1,1.00,"20,345.00","CRC 13,284.63","$7,060.37"
SOP MOTOR LH (CAJA) CHEVROLET AVEO 1,1,1.00,"27,168.14","CRC 20,110.71","$7,057.43"
BOMBILLO 24V P21/ 5W DOBLE CONTACTO BAY15D .,33,33.00,"8,326.01","CRC 1,270.50","$7,055.51"
SOPORTE MOTOR DELANTRO RH SUZUKI 3235,1,1.00,"31,858.41","CRC 24,804.85","$7,053.56"
BOMBILLO 12V 35W (IGUAL A H11 55W) .,10,10.00,"9,911.49","CRC 2,860.00","$7,051.49"
FILTRO CAJA AUTOMATICA COROLLA 2015 1.8 2ZR,1,1.00,"19,051.33","CRC 12,000.00","$7,051.33"
AMORTIGUADOR DELANTERO RH NISSAN TIIDA,1,1.00,"26,991.15","CRC 19,950.00","$7,041.15"
FAJA ACCENT BLUE AI/ACC ELANTRA 07 RIO RAV4 09-14 6PK1255,6,6.00,"28,362.83","CRC 21,324.48","$7,038.35"
BOMBA AUX FRENO HYUNDAI ACCENT VERNA R/L 3/4 58330-25000,3,3.00,"26,814.16","CRC 19,779.27","$7,034.89"
PASTILLA F CHEVROLET AVEO 10- EPICA DW NUB/LANO/LEGAN,2,2.00,"30,796.46","CRC 23,765.00","$7,031.46"
ROLL BOC DEL INT NS D21 PATH FRONTER 4X4,2,2.00,"23,628.32","CRC 16,598.50","$7,029.82"
"ESCOBILLA 20"" PYLON",12,12.00,"35,723.75","CRC 28,694.52","$7,029.23"
ROT.DIR. LH-RH / MOD: CHERY-TIGGO 2 18-23 /M.12X14X94,1,1.00,"11,415.93","CRC 4,400.00","$7,015.93"
SOP MOT RH MIT MIRAGE 14-19,1,1.00,"26,991.15","CRC 19,976.00","$7,015.15"
ANILLOS 33795 020 Z6 ZY 78.50 SWT-20087 1.2x1.2x,1,1.00,"26,814.16","CRC 19,800.00","$7,014.16"
BOMBA AGUA TOYOTA TUNDRA-SEQUOIA 5.7 ST213,1,1.00,"26,814.16","CRC 19,800.00","$7,014.16"
SL-3890L-M ROT ESTAB DEL LH HILUX 04 - 48810-0K,1,1.00,"26,814.16","CRC 19,800.00","$7,014.16"
SL-3890R-M ROT ESTAB DEL RH HILUX 04- - 48820,1,1.00,"26,814.16","CRC 19,800.00","$7,014.16"
ROTULA INF OPTRA 2006-2010,2,2.00,"26,902.65","CRC 19,889.12","$7,013.53"
P.F. NS PLATINA 00- RENAULT CLIO 01-05 e845 / d1146 / d292,1,1.00,"16,902.65","CRC 9,890.92","$7,011.73"
TIJERETA LH SUZ GRAND VITARA 98/05 XL7,1,1.00,"35,741.59","CRC 28,730.00","$7,011.59"
TIJERETA RH SUZ GRAND VITARA 98/05 XL7,1,1.00,"35,741.59","CRC 28,730.00","$7,011.59"
ARBOL DE LEVAS 4D56,1,1.00,"26,991.15","CRC 19,985.00","$7,006.15"
ROTULA ESTABILIZADORA DELANTERO RH CHEVROLET GMC SONIC 12-20,4,4.00,"37,610.62","CRC 30,605.24","$7,005.38"
HELLA 8GL 226 971-531 BOMBILLO VEHICULO LED H7 6500K 12/24V 20W (VENTAXCAJA 2UND),1,1.00,"26,814.16","CRC 19,809.00","$7,005.16"
